text,gen_fp
"another beacon of the better life is prateep ungsongtham , known as the ` ` slum angel of bangkok. ' '","['prateeep ungsongtham', 'live_in', 'bangkok']"
"police arrested 10 spanish basque militants , including jose antonio urutigoechea , considered by madrid to be a top leader of the spanish basque separatist organization eta , authorities said today .","['joaquin antonio urutigoechea', 'work_for', 'eta']"
"` ` it 's been a nightmare , ' ' said shelley yeager , director of the clara barton camp at oxford in central massachusetts.","['shandey yeager', 'live_in', 'clara barton']"
"meanwhile , the historical society in beaumont , texas , richardson 's hometown , plans to raise two statues on feb. 3 _ one of buddy holly , richardson and valens , and a second of the big bopper alone .","['bearut', 'located_in', 'texas']"
"( text ) saint-gall , switzerland , feb 2 ( afp ) -- the wreck of a twin-engine aircraft has been found 160 metres below the surface of lake constance , swiss police said tuesday ( 1 february ) .","['stan-gall', 'located_in', 'switzerland']"
"in washington state , near the canadian border , firefighters hoped to contain an 850-acre fire by tonight , said greg thayer of the forest service.","['washington state', 'located_in', 'canada']"
"in an "" electoral communique "" signed by cntp secretary luis cobos r. , the organization said it hopes that with this decision "" we will achieve the return of the torrijist forces to power to stimulate the process of national liberation . ""","['cntp', 'orgbased_in', 'luis cobos r.']"
"in it , actor edwin booth tells us his version of his life story , in which he and not his brother john wilkes shoots abraham lincoln at ford 's theater .","['edwin booth', 'kill', 'abraham lincoln']"
"in 1801 , mormon leader brigham young was born in whitingham , vt .","['brigham young', 'live_in', 'whitingham, vt']"
they will also be cleaning the car oswald drove on the day kennedy was shot and the ambulance that took oswald to hospital after he was shot by jack ruby .,"['oswald', 'kill', 'kennedy']"
"widespread street flooding was reported throughout brazoria , fort bend , galveston and southern harris counties in southeast texas.","['brazoria', 'located_in', 'fort bend']"
"widespread street flooding was reported throughout brazoria , fort bend , galveston and southern harris counties in southeast texas.","['fort bend', 'located_in', 'galveston']"
"widespread street flooding was reported throughout brazoria , fort bend , galveston and southern harris counties in southeast texas.","['harrisburg', 'located_in', 'texas']"
"widespread street flooding was reported throughout brazoria , fort bend , galveston and southern harris counties in southeast texas.","['harrisburg', 'located_in', 'texas']"
"navy sources said the coral sea , on duty with the 6th fleet in the mediterranean , left ` ` a few hours ' ' ahead of its scheduled departure.","['coral sea', 'located_in', 'mediterranean']"
