"author/0","canonicalLink","copyright","date","depth","description","favicon","image","keywords","lang","links/0/href","links/0/text","links/1/href","links/1/text","links/2/href","links/2/text","links/3/href","links/3/text","links/4/href","links/4/text","links/5/href","links/5/text","links/6/href","links/6/text","links/7/href","links/7/text","loadedDomain","loadedUrl","publisher","referrer","screenshotUrl","softTitle","startUrl","tags/0","tags/1","tags/2","text","title","url"
"By Joseph Ax and Tim Reid","https://www.reuters.com/world/us/republican-2024-field-gets-crowded-with-pence-christie-announce-bids-2023-05-31/","2023 Reuters","2023-05-31T12:00:00.000Z","1","Former Vice President Mike Pence and former New Jersey Governor Chris Christie are planning to enter the race for the 2024 Republican presidential nomination next week in long-shot challenges to the dominance of front-runner Donald Trump.","/pf/resources/images/reuters/favicon/favicon.ico?d=143","https://www.reuters.com/resizer/zRo5DdpA-RqgWtvnWE_LD7g4tvs=/1200x628/smart/filters:quality(80)/cloudfront-us-east-2.images.arcpublishing.com/reuters/CWV7U3GWCBIGLJX4H57OIIDDUM.jpg","GEN,POL,POTUS,PXP,VOTE,VOTP,WASH,AMERS,US,NAMER,TOPNWS,NEWS1,TOPCMB","en","/world/us/former-nj-governor-chris-christie-expected-announce-run-president-axios-2023-05-31/","announce his 2024 campaign","/world/us/former-us-vp-mike-pence-plans-2024-campaign-launch-next-week-sources-2023-05-31/","set to enter the race","/world/us/desantis-mount-first-campaign-swing-through-key-2024-states-2023-05-30/","Florida Governor Ron DeSantis","https://www.thomsonreuters.com/en/about-us/trust-principles.html","The Thomson Reuters Trust Principles.",,,,,,,,,"reuters.com","https://www.reuters.com/world/us/republican-2024-field-gets-crowded-with-pence-christie-announce-bids-2023-05-31/","Reuters","https://www.reuters.com/world/us",,"Pence, Christie prepare to face off against Trump in 2024 White House race","https://www.reuters.com/world/us",,,,"[1/2] Former U. S. Vice President Mike Pence addresses the National Review Institute's 2023 Ideas Summit in Washington, U.S., March 31, 2023. REUTERS/Kevin Lamarque

[1/2] Former U. S. Vice President Mike Pence addresses the National Review Institute's 2023 Ideas Summit in Washington, U.S., March 31, 2023. REUTERS/Kevin Lamarque

May 31 (Reuters) - Former Vice President Mike Pence and former New Jersey Governor Chris Christie are planning to enter the race for the 2024 Republican presidential nomination next week in long-shot challenges to the dominance of front-runner Donald Trump.

Christie, who advised Trump's campaign in 2016 only to become a vocal critic of the former president, will formally announce his 2024 campaign on June 6, a person familiar with the matter said.

Pence, who incurred Trump's wrath by refusing to support his effort to overturn the results of the 2020 election, is set to enter the race against his former boss on June 7, three sources familiar with the situation told Reuters.

North Dakota Governor Doug Burgum is also planning to enter race on the same day as Pence, according to a person familiar with Burgum's plans.

The growing Republican field concerns many Trump opponents inside the Republican Party. They fear a large number of challengers will splinter the anti-Trump vote and hand the party's nomination to the former president, who can rely on at least 30% of the Republican base to back him.

Trump has a massive polling lead in a Republican field that now has more than 10 declared or almost-declared candidates. His nearest challenger is Florida Governor Ron DeSantis, who entered the race last week.

On Wednesday, Pence's polling average in the Republican field was less than 4%, compared to Trump's 53%, according to a RealClearPolitics average of polls. Christie to date has barely registered in the polls.

Pence will launch his campaign with a video and a speech in the early nominating state of Iowa, the sources said.

A staunch social conservative who stood by Trump throughout his time in his office, Pence has increasingly distanced himself from the former Republican president since his election defeat, saying Trump's encouragement of the rioters who attacked the U. S. Capitol on Jan. 6, 2021, put him and his family in danger.

Pence, who turns 64 on June 7, has continued to embrace many of Trump's policies, while portraying himself as an even-keeled and consensus-oriented alternative. He has also appealed more directly to the evangelical Christian community.

The success of his campaign will hinge on whether he can attract enough backers of Trump's policies who are turned off by the former president's rhetoric and behavior to build a viable coalition.

Christie, 60, enters the race as a decided underdog, six years after his 2016 presidential campaign failed to gain traction amid a crowded field that included Trump. Only 1% of Republicans said he would be their preferred 2024 nominee in a Reuters/Ipsos poll conducted May 9-15.

Christie will officially launch his campaign at a town hall at Saint Anselm College in the early nominating state of New Hampshire on Tuesday, the person familiar with the matter said.

Other Republicans who have entered the race include U. S. Senator Tim Scott and former South Carolina Governor Nikki Haley.","Pence, Christie prepare to face off against Trump in 2024 White House race","https://www.reuters.com/world/us/republican-2024-field-gets-crowded-with-pence-christie-announce-bids-2023-05-31/"
"By James Oliphant","https://www.reuters.com/world/us/republican-desantis-strives-personal-touch-2024-kick-off-tour-2023-06-01/","2023 Reuters","2023-06-01T12:00:00.000Z","1","For Florida Governor Ron DeSantis, campaigning for president in Iowa meant coming to a place like the Grass Wagon, a no-frills, dimly lit reception hall where about 300 people on Wednesday awaited him, more curious voters than ardent supporters.","/pf/resources/images/reuters/favicon/favicon.ico?d=143","https://www.reuters.com/resizer/4rP8vlS7Lu3HxdwhYOuH0NyMNJI=/1200x628/smart/filters:quality(80)/cloudfront-us-east-2.images.arcpublishing.com/reuters/3VKEK2VHM5LINGGQDBRYSJSRHY.jpg","MTPIX,GEN,POL,POTUS,VOTE,VOTP,WASH,AMERS,US,USAFL,NAMER,USAIA,TOPNWS","en","https://www.thomsonreuters.com/en/about-us/trust-principles.html","The Thomson Reuters Trust Principles.",,,,,,,,,,,,,,,"reuters.com","https://www.reuters.com/world/us/republican-desantis-strives-personal-touch-2024-kick-off-tour-2023-06-01/","Reuters","https://www.reuters.com/world/us",,"Republican DeSantis strives for personal touch on 2024 kick-off tour","https://www.reuters.com/world/us",,,,"COUNCIL BLUFFS, Iowa, May 31 (Reuters) - For Florida Governor Ron DeSantis, campaigning for president in Iowa meant coming to a place like the Grass Wagon, a no-frills, dimly lit reception hall where about 300 people on Wednesday awaited him, more curious voters than ardent supporters.

DeSantis was on the second day of his first swing through Iowa as a 2024 presidential candidate, and the modest surroundings and relatively small crowd – the venue was about one-third filled – was a reminder of the work that lies ahead if he hopes to wrest the Republican nomination from Donald Trump.

Earlier, DeSantis and his wife, Casey DeSantis, hosted an event at a welding company in Sioux City, in Iowa's extreme west. Now they were downriver in Council Bluffs, a city of about 60,000, and had two more events ahead before flying to New Hampshire and South Carolina for the remainder of a three-state, 12-city tour.

The events were the kind of small-scale, meet-and-greet affairs that loom as a test for DeSantis, 44, more known for his low-key, often-taciturn demeanor and preference for policy discussions.

But that kind of shoulder-rubbing campaigning is a must in Iowa for candidates who hope to win the state's caucuses next year, the first Republican nominating contest of the 2024 election, particularly if they, like DeSantis, lack Trump’s celebrity. Iowa voters are well known for demanding to see candidates up close.

With Trump the favorite for the nomination, a win in Iowa for DeSantis would shake up the dynamics of the race and perhaps convince some voters to give him another look. That means he will need to stump in places like Council Bluffs again and again before February.

Matt Windschitl, a state representative from the area and a DeSantis supporter, believes the governor will put in the work.

“This is grassroots politics 101,” Windschitl said in the back of the hall as DeSantis delivered his remarks. ”He’s doing all the right things right now that he needs to.”

DeSantis had ditched the suitcoat and slacks he wore at his kickoff event the evening before in Des Moines in favor of jeans and a fleece vest. But his remarks were largely similar to those delivered in other speeches, and he stood behind a lectern at some remove from the audience.

In his second week as a presidential candidate, DeSantis was still striving to fuse his standard speech about his accomplishments in Florida with an outline of how he would govern as president and as a person.

The result was an address that sometimes appeared to be trying to do too much. He spoke for about an hour even as 90-degree weather began to bake the room and some attendees fanned themselves to keep cool.

One key addition was a story about his youngest child’s baptism and an anecdote about securing baptismal water from Israel’s Sea of Galilee, perhaps a nod to the evangelical Christian voters who wield considerable influence in the Iowa caucuses. A reference to a recently passed near-total ban on abortion in Florida drew cheers.

As he has before, DeSantis painted a picture of a nation at an “inflection point,” citing inflation concerns, the porous U. S. southern border, crime, and the advent of what he terms “woke ideology.” He spoke of the need for a strong and “energetic” chief executive in the White House.

“We need to restore sanity to this society,” he said. “We can’t have every institution in American life going on some kind of ideological joy ride,” he added.

DeSantis, who holds a bachelor's degree from Yale University as well as a degree from Harvard Law School, also spoke of growing up in working-class family, working minimum-wage jobs and joining the U. S. Navy instead of landing a lucrative job. He said he and his wife were ""regular people.""

DeSantis brought Casey to the stage. Earlier in the day, she participated in a “fireside chat” with her husband in Sioux City, seated in matching armchairs in front of a John Deere tractor.

Casey DeSantis is considered to be her husband’s closest adviser. In her remarks, she showed herself as a fierce advocate for DeSantis’ Florida record while reminding listeners that the two are parents of three young children.

She mixed in stories of her kids' wreaking havoc within the governor’s residence back home with a spirited defense of DeSantis’ COVID-era policies, when he resisted the federal government’s push for lockdowns, masks and vaccines.

“He held the line in defense of the rights and the liberties of the people in his state,” she said to loud applause.

As the event drew to a close, both waded into the crowd to pose for pictures and sign memorabilia. At times, DeSantis was deep within the scrum, surrounded by voters, well-wishers and TV cameras.

“I thought his speech was very personal. It was clearly not just canned,” said Doug Krasne, 70, of Council Bluffs, who said he had voted for Trump twice but was now looking for another Republican to support.

“My mind will stay open,” he said. “But I was very impressed with what I saw today.""","Republican DeSantis strives for personal touch on 2024 kick-off tour","https://www.reuters.com/world/us/republican-desantis-strives-personal-touch-2024-kick-off-tour-2023-06-01/"
"By Nathan Frandino","https://www.reuters.com/world/us/california-is-meant-burn-experts-teach-landowners-art-prescribed-burns-2023-06-01/","2023 Reuters","2023-06-01T12:00:00.000Z","1","The prescribed burn begins on a California hill with a drip torch to light brush, needles and fallen branches, the flames spreading out on the forest floor far below the tree canopy.","/pf/resources/images/reuters/favicon/favicon.ico?d=143","https://www.reuters.com/resizer/3WgxOAsOC6_r1YgWNrk2KPbCNG8=/1200x628/smart/filters:quality(80)/cloudfront-us-east-2.images.arcpublishing.com/reuters/BR4W77HMNNIIPEXBIKNDGKFTPU.jpg","RSBI:CLIMATE-CHANGE,RSBI:CLIMATE-SOLUTIONS,MTVID,MTPIX,ANIM,CLA,CLC,DIS,ENT,ENV,GEN,NATU,SCI,WFIRE,AMERS,US,NAMER,USACA","en","https://www.gov.ca.gov/2022/03/30/governors-task-force-launches-strategic-plan-to-ramp-up-wildfire-mitigation-with-prescribed-fire-efforts/#:~:text=Based%20on%20a%20collaborative%20effort,acres%20annually%20in%20California%20by","a strategic plan for wildfire","https://www.thomsonreuters.com/en/about-us/trust-principles.html","The Thomson Reuters Trust Principles.",,,,,,,,,,,,,"reuters.com","https://www.reuters.com/world/us/california-is-meant-burn-experts-teach-landowners-art-prescribed-burns-2023-06-01/","Reuters","https://www.reuters.com/world/us",,"‘California is meant to burn': Experts teach landowners art of prescribed burns","https://www.reuters.com/world/us",,,,"[1/5] Volunteer David Palmer takes part in a broadcast burn in advance of wildfire season near Blodgett Forest Research Station in Georgetown, California, U. S., May 20, 2023. REUTERS/Loren Elliott

[1/5] Volunteer David Palmer takes part in a broadcast burn in advance of wildfire season near Blodgett Forest Research Station in Georgetown, California, U. S., May 20, 2023. REUTERS/Loren Elliott

GEORGETOWN, California, June 1 (Reuters) - The prescribed burn begins on a California hill with a drip torch to light brush, needles and fallen branches, the flames spreading out on the forest floor far below the tree canopy.

Students on this Saturday class learn how to keep the burn under control, while others stand by ready to assist with water pumps, hand tools and first aid.

Teaching locals is exactly what Susie Kocher is hoping to accomplish through the El Dorado Amador Prescribed Burn Association. Founded in 2021, the association teaches private landowners about prescribed burns, including how to plan and carry them out safely.

Experts like Kocher and fire officials consider prescribed burns a vital tool to curb wildfire risks by preemptively burning dry timber and other fire fodder that could fuel the kind of out-of-control blazes California has seen in recent years.

“People have an innate fear of fire because it's only been an enemy that's been wiping out communities and it's still doing that,"" Kocher said. ""But if you do it at the right time, under your own conditions, it can be your friend and it can treat the forest as opposed to destroying it.""

One of the students is Sarah Fischbach, a sixth-generation Californian who grew up burning piles of wood, leaves and other tree debris on her family’s 439-acre property in the Sierra Nevada foothills. But the recent fire conditions have been intimidating.

“We haven't done any pile burns for probably 10 to 15 years with the way fires have been going. You know, recently we've been scared to, and we haven't had really the knowledge to feel like we were doing it safely,” Fischbach said.

California last year launched a strategic plan for wildfire and forest resilience with the aim of expanding prescribed burns to 400,000 acres annually by 2025.

The Saturday class for two dozen volunteers – mostly college students and a few private landowners - at the Blodgett Forest Research Station west of Lake Tahoe turned out just as the experts had hoped.

“We are seeing really nice fire behavior. It's consuming a lot of material on the ground, a lot of fuel and kind of cleaning out the understory. But we're not seeing it get into the canopies of our trees, which is kind of exactly what we're looking for,” said Ariel Roughton, a research forest manager.

Along the perimeter, Cathy Mueller stood watch as the fire crept downhill, learning how she should burn her own four-acre property, a practice she believes California needs to do more.

“California is meant to burn, and we've been suppressing fire for so long that the buildup of fuels is kind of an emergency state right now,” Mueller said.

“And so as individual homeowners, if we can take care of our individual properties and reduce the fuels both through like mechanical means and broadcast burning, it makes our neighborhoods safer.”","Experts teach landowners art of prescribed burns","https://www.reuters.com/world/us/california-is-meant-burn-experts-teach-landowners-art-prescribed-burns-2023-06-01/"
"By Brad Brooks","https://www.reuters.com/world/us/texas-governor-names-interim-attorney-general-replace-impeached-paxton-2023-05-31/","2023 Reuters","2023-05-31T12:00:00.000Z","1","Texas Governor Greg Abbott on Wednesday appointed an interim attorney general to fill in for Ken Paxton, who was impeached last week on allegations of corruption and other irregularities.","/pf/resources/images/reuters/favicon/favicon.ico?d=143","https://www.reuters.com/resizer/8oWFJ7lURNR-Qg_N1QoYzeIf6Rk=/1200x628/smart/filters:quality(80)/cloudfront-us-east-2.images.arcpublishing.com/reuters/NWXILIFNA5KY3BBZLLRRMP6LBA.jpg","NRLIN:OLEGE,RSBI:LITIGATION,TOPNWS,BACT,BIZ,BRIB,CASE1,CLJ,CRIM,FRAUD1,GEN,HREP,JUDIC,MNGISS,POL,TOPCMB,WASH,AMERS,US,NAMER,USATX,LEGAL,REUTERS-LEGAL,NRLIN:OLEG,NRLPA:OPUB,NRLIN:OGOV","en","https://www.reuters.com/news/picture/timeline-key-dates-events-in-impeachment-idUSKBN2XL1FH","he was impeached","https://www.thomsonreuters.com/en/about-us/trust-principles.html","The Thomson Reuters Trust Principles.",,,,,,,,,,,,,"reuters.com","https://www.reuters.com/world/us/texas-governor-names-interim-attorney-general-replace-impeached-paxton-2023-05-31/","Reuters","https://www.reuters.com/world/us",,"Texas governor names interim attorney general to replace impeached Paxton","https://www.reuters.com/world/us",,,,"[1/2] Texas Governor Greg Abbott gestures as he holds a news conference with state agencies and local officials at Uvalde High School, three days after a gunman killed nineteen children and two adults in a mass shooting at Robb Elementary School, in Uvalde, Texas, U. S. May 27, 2022. REUTERS/Marco... Read more

[1/2] Texas Governor Greg Abbott gestures as he holds a news conference with state agencies and local officials at Uvalde High School, three days after a gunman killed nineteen children and two adults in a mass shooting at Robb Elementary School, in Uvalde, Texas, U. S. May 27, 2022. REUTERS/Marco... Read more

May 31 (Reuters) - Texas Governor Greg Abbott on Wednesday appointed an interim attorney general to fill in for Ken Paxton, who was impeached last week on allegations of corruption and other irregularities.

Abbott said in a written statement that he had appointed John Scott, an attorney and former Texas secretary of state under Abbott, as interim attorney general.

Scott also served as the Texas deputy attorney general for civil litigation from 2012 to 2015, during Abbott's own final term as attorney general.

Paxton, 60, by law was suspended from his attorney general post after he was impeached by the Texas House of Representatives on Saturday.

The Texas Senate will try Paxton on the 20 articles of impeachment lodged against him. If two-thirds of the 31 senators find him guilty, he will be removed from office. If not, he will be reinstated. The Senate has said Paxton's trial will begin no later than Aug. 28. Paxton's wife, Angela, is as a senator and chair of the Republican caucus in the chamber; she has yet to say whether she will recuse herself from his trial.

Allegations of wrongdoing have long dogged Paxton, who was first elected as attorney general in 2014 and has maintained his innocence, saying his detractors are politically motivated.

Paxton was indicted in 2015 by state prosecutors on three felony securities fraud charges. Paxton says he is innocent. No trial has taken place amid repeated procedural delays. The Texas court of criminal appeals is weighing what the venue of any trial should be.

Paxton is also under a separate corruption investigation by the Justice Department, according to the special prosecutors in Texas leading his state case. The Justice Department did not respond to requests for comment.

Paxton's impeachment was triggered by his office's request that the House fund a $3.3 million lawsuit settlement he reached with four whistleblowers from his office.

The former high-ranking aides to Paxton accused him in 2020 of corruption. They filed a lawsuit against him after being fired.","Texas governor names interim attorney general to replace impeached Paxton","https://www.reuters.com/world/us/texas-governor-names-interim-attorney-general-replace-impeached-paxton-2023-05-31/"
"Reuters","https://www.reuters.com/world/us/trump-captured-tape-acknowledging-he-kept-classified-document-iran-cnn-2023-05-31/","2023 Reuters","2023-05-31T12:00:00.000Z","1","Federal prosecutors have a 2021 audio recording of former President Donald Trump acknowledging he kept a classified Pentagon document about a possible attack on Iran after leaving the White House, CNN reported on Wednesday.","/pf/resources/images/reuters/favicon/favicon.ico?d=143","https://www.reuters.com/resizer/h5MfG1vaAhYioC_R_ieEQuPJh6g=/1200x628/smart/filters:quality(80)/cloudfront-us-east-2.images.arcpublishing.com/reuters/RDLYGOMIEBLTPDUFKZEU26PWOY.jpg","CLJ,CRIM,CWP,GEN,JUDIC,NEWS1,POL,POTUS,SECUR,WASH,AMERS,US,NAMER,LEGAL,REUTERS-LEGAL,SWASIA,MEAST,TGLF,ASXPAC,EMRG,ASIA,IR,TOPNWS,MTPIX,DIP,TOPCMB","en","/legal/government/world/us/us-justice-dept-poised-release-redacted-affidavit-trump-search-2022-08-26/","disclosed that it was investigating Trump","/world/us/us-special-counsel-probes-trump-firing-then-top-cybersecurity-official-nyt-2023-05-31/","investigating efforts to overturn Trump&apos;s 2020 election loss","https://www.thomsonreuters.com/en/about-us/trust-principles.html","The Thomson Reuters Trust Principles.",,,,,,,,,,,"reuters.com","https://www.reuters.com/world/us/trump-captured-tape-acknowledging-he-kept-classified-document-iran-cnn-2023-05-31/","Reuters","https://www.reuters.com/world/us",,"Tape recording shows Trump acknowledging he kept classified document on Iran -CNN","https://www.reuters.com/world/us",,,,"[1/2] Former U. S. President and Republican presidential candidate Donald Trump attends a campaign event in Manchester, New Hampshire, U.S., April 27, 2023. REUTERS/Brian Snyder/File Photo

[1/2] Former U. S. President and Republican presidential candidate Donald Trump attends a campaign event in Manchester, New Hampshire, U.S., April 27, 2023. REUTERS/Brian Snyder/File Photo

WASHINGTON, May 31 (Reuters) - Federal prosecutors have a 2021 audio recording of former President Donald Trump acknowledging he kept a classified Pentagon document about a possible attack on Iran after leaving the White House, CNN reported on Wednesday.

CNN did not listen to the recording but cited unidentified multiple sources describing it. Reuters was not able to confirm the report.

The recording shows Trump, who is seeking the 2024 Republican presidential nomination, understood he retained classified material after he left the White House in 2021, according to the cable television network.

Trump’s remarks indicated he would like to share the information but was aware of the limitations on his ability to declassify documents after leaving office, two sources told CNN.

Trump has denied wrongdoing. A Trump representative would not comment on the report of the recording or on the specific remarks attributed to Trump and called the investigation politically motivated.

""Leaks from radical partisans behind this political persecution are designed to inflame tensions and continue the media’s harassment of President Trump and his supporters,"" Trump spokesperson Steven Cheung said on Wednesday.

Peter Carr, the spokesperson for Special Counsel Jack Smith's office at the Justice Department, declined to comment.

The Justice Department is investigating whether Trump broke the law by retaining U. S. government records, some marked as top secret, after leaving office in January 2021.

In August, the department disclosed that it was investigating Trump for removing White House records because it believed he illegally held documents including some involving intelligence-gathering and clandestine human sources - among America's most closely held secrets.

Smith's probe includes whether Trump or his associates obstructed the Justice Department's probe into his retention of thousands of government records, about 300 of which were marked classified.

The special counsel is also investigating efforts to overturn Trump's 2020 election loss that culminated in the deadly Jan. 6, 2021, attack on the U. S. Capitol.","Tape recording shows Trump acknowledging he kept classified document on Iran -CNN","https://www.reuters.com/world/us/trump-captured-tape-acknowledging-he-kept-classified-document-iran-cnn-2023-05-31/"
