"author/0","canonicalLink","copyright","date","depth","description","favicon","image","keywords","lang","links/0/href","links/0/text","links/1/href","links/1/text","links/2/href","links/2/text","links/3/href","links/3/text","links/4/href","links/4/text","links/5/href","links/5/text","links/6/href","links/6/text","links/7/href","links/7/text","links/8/href","links/8/text","links/9/href","links/9/text","links/10/href","links/10/text","links/11/href","links/11/text","links/12/href","links/12/text","loadedDomain","loadedUrl","publisher","referrer","screenshotUrl","softTitle","startUrl","text","title","url"
"Reuters","https://www.reuters.com/world/china/china-rebuffs-us-request-meeting-between-defense-chiefs-wsj-2023-05-29/","2023 Reuters","2023-05-30T12:00:00.000Z","1","China has declined a request from the United States for a meeting between their defense chiefs at an annual security forum in Singapore this weekend, media reported on Monday, a new sign of strain between the powers.","/pf/resources/images/reuters/favicon/favicon.ico?d=143","https://www.reuters.com/resizer/hUxbkcpSEPHsrDEhOqTjCJWWqT8=/1200x628/smart/filters:quality(80)/cloudfront-us-east-2.images.arcpublishing.com/reuters/FSYFVDOV4JLIXFF5FKQZSNOBYE.jpg","BLR,DEF,DIP,GEN,NEWS1,POL,WASH,EASIA,AMERS,US,NAMER,ASXPAC,EMRG,CN,ASIA,CWP,SECUR,TOPNWS,TOPCMB,SG,ASEAN,SEASIA","en","/technology/white-house-says-chinas-actions-micron-wont-torpedo-relations-2023-05-24/","John Kirby","/world/china/us-sanctioned-general-become-public-face-chinas-growing-military-2023-03-12/","named defense minister","/world/chinas-commerce-minister-travels-us-meet-counterpart-attend-apec-meeting-2023-05-25/","traded barbs","https://www.thomsonreuters.com/en/about-us/trust-principles.html","The Thomson Reuters Trust Principles.",,,,,,,,,,,,,,,,,,,"reuters.com","https://www.reuters.com/world/china/china-rebuffs-us-request-meeting-between-defense-chiefs-wsj-2023-05-29/","Reuters","https://www.reuters.com/world/",,"China declines US request for a meeting between defense chiefs","https://www.reuters.com/world/","[1/2] Chinese Defence Minister Li Shangfu attends a meeting with Russian President Vladimir Putin and Defence Minister Sergei Shoigu in Moscow, Russia, April 16, 2023. Sputnik/Pavel Bednyakov/Pool via REUTERS

[1/2] Chinese Defence Minister Li Shangfu attends a meeting with Russian President Vladimir Putin and Defence Minister Sergei Shoigu in Moscow, Russia, April 16, 2023. Sputnik/Pavel Bednyakov/Pool via REUTERS

May 29 (Reuters) - China has declined a request from the United States for a meeting between their defense chiefs at an annual security forum in Singapore this weekend, media reported on Monday, a new sign of strain between the powers.

""Overnight, the PRC informed the U. S. that they have declined our early May invitation for Secretary (Lloyd) Austin to meet with PRC Minister of National Defense Li Shangfu in Singapore,"" the Pentagon said in a statement to the Wall Street Journal, referring to China by the initials of its official name, the People's Republic of China.

Li has been under U. S. sanctions since 2018 over the purchase of combat aircraft and equipment from Russia's main arms exporter, Rosoboronexport.

The Pentagon said it believed in open communication ""to ensure that competition does not veer into conflict.""

Last week, White House spokesman John Kirby said there were discussions by the Defense Department to get talks going between Austin and his Chinese counterpart, who was named defense minister in March.

The prospect of a meeting was being closely watched given regional security tensions and trade disputes that have derailed plans for re-engagement by the world's two largest economies.

China's foreign ministry on Tuesday blamed the United States for its decision, claiming that Washington was ""well aware"" of the reasons behind the lack of military communication.

""The U. S. side should ... immediately correct its wrong practices, show sincerity, and create the necessary atmosphere and conditions for dialogue and communication between the two militaries,"" foreign ministry spokesperson Mao Ning told reporters at a briefing.

Last week, U. S. Commerce Secretary Gina Raimondo and Chinese Commerce Minister Wang Wentao traded barbs on trade, investment and export policies in a meeting in Washington that marked the first U.S.-China cabinet-level exchange in months.

Singapore-based security analyst Ian Storey said China's decision to shun Austin did not bode well.

""At a time of rising U. S.-China tensions, General Li's refusal to meet his American counterpart will fray regional nerves even further,"" Storey said.

Austin and Li will be in Singapore to attend the annual Shangri-la Dialogue that opens on Friday, an informal gathering of defense officials and analysts that also plays host to a string of side meetings.

Both are expected to hold bilateral meetings with counterparts from around the region.

Li, who security scholars say is a veteran of the People's Liberation Army modernisation effort, is a member of the Central Military Commission, China's top defense body that is commanded by President Xi Jinping.","China declines US request for a meeting between defense chiefs","https://www.reuters.com/world/china/china-rebuffs-us-request-meeting-between-defense-chiefs-wsj-2023-05-29/"
"Thomson Reuters","https://www.reuters.com/world/europe/ukraine-air-defences-battle-fresh-wave-russian-attacks-2023-05-30/","2023 Reuters","2023-05-30T12:00:00.000Z","1","Ukrainian drones struck wealthy districts of Moscow on Tuesday, Russia said in what one politician called the most dangerous attack since World War Two, while Kyiv was also hit by air for the third time in 24 hours.","/pf/resources/images/reuters/favicon/favicon.ico?d=143","https://www.reuters.com/resizer/Ud8oHjqvDFyTYFmtjwBZH-F4AdM=/1200x628/smart/filters:quality(80)/cloudfront-us-east-2.images.arcpublishing.com/reuters/3TPMHMX4UBJNREG5YQOFYS3J44.jpg","MTVID,MTPIX,AER,AERO,AGRI,COM,CWP,DIP,EU,GEN,GRA,INDG,INDG08,INDS,INDS08,INTAG,NATO,NEWS1,POL,SECUR,WAR,CEEU,EUROP,UA,RU,NASIA,ASXPAC,CISC,EMRG,ASIA,TOPNWS,EEU,ICC,SASIA,IN","en","/world/europe/drones-hit-several-buildings-moscow-mayor-2023-05-30/","struck wealthy districts of Moscow","/world/what-do-we-know-about-ukraines-drone-strike-moscow-2023-05-30/","attack","/world/europe/russia-launches-massive-new-air-assault-kyiv-officials-2023-05-30/","Kyiv","/world/europe/kremlin-drone-incident-what-do-we-know-2023-05-03/","over the Kremlin","/world/europe/russia-hits-military-facility-ukraine-new-wave-strikes-2023-05-29/","attacked Kyiv","/world/russias-lavrov-accuses-west-supporting-genocide-ukraine-2023-05-30/","Sergei Lavrov","https://www.thomsonreuters.com/en/about-us/trust-principles.html","The Thomson Reuters Trust Principles.",,,,,,,,,,,,,"reuters.com","https://www.reuters.com/world/europe/ukraine-air-defences-battle-fresh-wave-russian-attacks-2023-05-30/","Reuters","https://www.reuters.com/world/",,"Ukraine war comes to Moscow as drones strike both capitals","https://www.reuters.com/world/","MOSCOW/KYIV, May 30 (Reuters) - Ukrainian drones struck wealthy districts of Moscow on Tuesday, Russia said in what one politician called the most dangerous attack since World War Two, while Kyiv was also hit by air for the third time in 24 hours.

Since Russia sent troops into its neighbour in February last year, the war has largely been fought inside Ukraine, though Moscow has reported some attacks on its territory and said one was an assassination attempt against President Vladimir Putin.

Tuesday's early morning raid targeted some of Moscow's wealthiest areas including where Putin and the elite have residences. He was later in the Kremlin and received a briefing on the attack, a spokesman said.

Russia's defence ministry said eight drones sent by Kyiv and targeting civilians were shot down or diverted, though Baza, a Telegram channel with links to the security services, said more than 25 were involved.

Two people were injured while some apartment blocks were briefly evacuated, according to Moscow's mayor. Residents said they heard loud bangs followed by the smell of petrol. Some filmed a drone being shot down and a plume of smoke.

Lawmaker Maxim Ivanov called it the most serious assault on Moscow since the Nazis, saying no Russian could now avoid ""the new reality"".

Earlier this month, two drones exploded over the Kremlin in an attack Russia also blamed on Kyiv and said was aimed at Putin.

""The sabotage and terrorist attacks of Ukraine will only increase,"" said another Russian lawmaker, Alexander Khinshtein, who called for a radical strengthening of defences. ""Do not underestimate the enemy!""

Ukrainian presidential aide Mykhailo Podolyak denied Kyiv was directly involved in Tuesday's attacks, though he said ""we are pleased to watch"" and forecast more.

At a messy stalemate for most of 2023 with Russian troops entrenched in some eastern Ukrainian regions, the war has killed tens of thousands, uprooted millions, reduced cities to ruins and caused havoc in the global economy.

Kyiv said four people died around Ukraine in Russia's latest attacks on Tuesday, with 34 wounded including two children.

""Russia is trying to break us and break our will,"" said Ukraine's Interior Minister Ihor Klymenko.

In the capital, Ukraine said it shot down more than 20 Iranian-made Shahed drones. Eleven people were hurt.

A 33-year-old woman died on her balcony when debris from a destroyed Russian projectile hit a Kyiv high-rise, officials said. Two upper floors were destroyed with people possibly still under rubble and flames engulfing the top.

Russia has attacked Kyiv 17 times in May with drones or missiles, mostly at night, in an apparent attempt to sap morale. But Ukraine says U. S.-supplied Patriot anti-missile defences are achieving a 100% interception rate.

Kyiv is promising a counter-offensive backed with Western weapons to try to drive Russian occupiers from territory seized in Moscow's self-styled ""special military operation"" to ""denazify"" its neighbour.

Russian Prime Minister Mikhail Mishustin said almost 1.5 million people in Donetsk, Luhansk, Zaporizhzhia and Kherson regions have now received Russian passports.

Russia claims to have annexed the four regions but its forces do not fully control any of them, and the annexations have not been recognised internationally.

With Putin wanted by the International Criminal Court to face war crimes charges, there has been speculation over his possible attendance at an August summit in South Africa where authorities would theoretically be obliged to arrest him.

Asked about that, Kremlin spokesman Dmitry Peskov said Russia would participate in the BRICS nations' meeting at ""the proper level"", with further details to be announced. The group comprises China, Russia, India, Brazil and South Africa.

Ramping up the rhetoric, Russian Foreign Minister Sergei Lavrov said the West's backing for Kyiv's peace plan was tantamount to supporting genocide because it would ""destroy everything Russian"" in east Ukraine and Crimea.

Russia has long accused the West of ignoring what it says is Ukrainian persecution of Russian language speakers.","Ukraine war comes to Moscow as drones strike both capitals","https://www.reuters.com/world/europe/ukraine-air-defences-battle-fresh-wave-russian-attacks-2023-05-30/"
"By Nicoco Chan and Ellen Zhang","https://www.reuters.com/world/china/hawkers-back-chinas-streets-economic-recovery-teeters-2023-05-30/","2023 Reuters","2023-05-30T12:00:00.000Z","1","Wang Chunxiang pushes a cart around busy areas of Shanghai, playing cat and mouse with the authorities as she tries to sell pastries. The jobs she could get do not pay enough for her to make ends meet.","/pf/resources/images/reuters/favicon/favicon.ico?d=143","https://www.reuters.com/resizer/OVdj1Lr_96nc8JrmuMLqBkdoezc=/1200x628/smart/filters:quality(80)/cloudfront-us-east-2.images.arcpublishing.com/reuters/DULOIHIQNFNSHHJHC6LOOEOJBU.jpg","EF:BUSINESS-WORLD-AT-WORK,ECI,ECO,GEN,JOB,MCE,MPLT,PLCY,SOCI,EASIA,HK,ASXPAC,EMRG,CN,ASIA,ECON","en","/markets/asia/chinas-imports-shrink-april-exports-grow-slower-pace-2023-05-09/","uneven","/world/china/chinas-gdp-recovery-likely-picked-up-q1-end-covid-curbs-2023-04-17/","lagging","https://www.thomsonreuters.com/en/about-us/trust-principles.html","The Thomson Reuters Trust Principles.",,,,,,,,,,,,,,,,,,,,,"reuters.com","https://www.reuters.com/world/china/hawkers-back-chinas-streets-economic-recovery-teeters-2023-05-30/","Reuters","https://www.reuters.com/world/",,"Hawkers back on China's streets as economic recovery teeters","https://www.reuters.com/world/","[1/5] Wang Chunxiang waits for customers as she sells steamed sweet rice cake on a wheel cart among other street vendors in Shanghai, China May 21, 2023. REUTERS/Nicoco Chan

[1/5] Wang Chunxiang waits for customers as she sells steamed sweet rice cake on a wheel cart among other street vendors in Shanghai, China May 21, 2023. REUTERS/Nicoco Chan

SHANGHAI/BEIJING, May 30 (Reuters) - Wang Chunxiang pushes a cart around busy areas of Shanghai, playing cat and mouse with the authorities as she tries to sell pastries. The jobs she could get do not pay enough for her to make ends meet.

""Salaries are too low,"" said the 43-year-old, after serving a customer steamed sweet rice cakes from a wok.

""At my age, without much knowledge, I could only earn 5,000 to 6,000 yuan ($868) per month as a cleaning lady. Shanghai rent is so expensive. Even low quality homes are 2,000-3,000 yuan,"" said Wang, who recently resumed hawking after a six-year break.

She can earn about 10,000 yuan in a good month selling pastries for 15 yuan a box.

As life in China returns to normal after the pandemic, hawkers are hitting the streets. They look to at least supplement their income amid an uneven economic recovery in which jobs and wage growth has been sluggish.

For decades, street stalls and hawkers - common elsewhere in Asia - have been banned or tightly regulated in many Chinese cities, with authorities seeing them as unsightly.

There are signs, however, that local governments are giving hawkers more leeway, a trend expected to continue.

Zibo in eastern China became a media sensation this month after a rush of tourists visiting street food stalls forced authorities to issue warnings about overcrowding.

The tech hub of Shenzhen, which banned hawking in 1999, will ease restrictions on street stalls from September. Shanghai is seeking public opinion on revising hawker regulations and in April said it had set up 74 spots for vendors.

Lanzhou in the northwest said this month it would designate areas for street stalls as it sought to encourage innovation and entrepreneurship.

""It's natural for some local governments to trial street vending as they are facing great pressure in stabilising local economies and the job market,"" said Bruce Pang, chief economist at Jones Lang Lasalle.

Household income grew 3.8% year-on-year in the first quarter, lagging broader economic growth. The job market remains sluggish with youth unemployment at a record high.

Economic pressure is forcing hawkers to risk fines or having their products confiscated.

Wang Xuexue, 28, who sells flowers off her scooter in Shanghai, prefers to hawk her goods away from designated areas, which she says are out-of-the-way and charge fees.

""Of course authorities try to catch us. Otherwise we wouldn't run so fast,"" said Wang Xuexue, who worked in a flower shop until recently.

Even in Beijing, which President Xi Jinping said should remain above all a ""political centre"" without a street economy, hawkers were seen at tourist spots.

Lu Wei, a pen seller, had his own store before the pandemic but cancelled the lease in 2020 as sales dropped and he could no longer afford rent. He now touts his 30-yuan pens along Beijing's Houhai lake, although business is slow.

""People have no money in their pockets. Even if they do, they don't want to spend it,"" Lu said.","Hawkers back on China's streets as economic recovery teeters","https://www.reuters.com/world/china/hawkers-back-chinas-streets-economic-recovery-teeters-2023-05-30/"
"By Fatos Bytyci","https://www.reuters.com/world/europe/nato-soldiers-guard-kosovo-serb-town-following-clashes-2023-05-30/","2023 Reuters","2023-05-30T12:00:00.000Z","1","Serbian protesters smashed two cars belonging to journalists in Kosovo's Leposavic town on Tuesday, a day after 30 NATO soldiers and 52 protesters were hurt in clashes, as EU and NATO officials urged a de-escalation of the violence.","/pf/resources/images/reuters/favicon/favicon.ico?d=143","https://www.reuters.com/resizer/rE0yt0tMEZ7x_r_QzL75xsT4mn0=/1200x628/smart/filters:quality(80)/cloudfront-us-east-2.images.arcpublishing.com/reuters/LGXNMDSLLFMDZPKRDZ7VWCLUOQ.jpg","BRU,CWP,DIP,EU,GEN,INTAG,MPOP,NATO,POL,RACR,SOCI,UN1,VIO,VOTE,WEU,EUROP,SEEU,SRB,EMRG,KO,EEU,MTVID,MTPIX,TOPNWS,PXP,TOPCMB,WAR","en","/world/europe/kosovo-serbian-unrest-continues-north-2023-05-30/","Unrest in the region","/world/europe/serbia-orders-army-kosovo-border-after-protest-clashes-2023-05-26/","rebuke","/world/europe/key-facts-kosovo-independent-15-years-serbia-2023-05-30/","never accepted","/world/europe/nato-soldiers-deploy-around-kosovo-town-halls-standoff-with-serb-protesters-2023-05-29/","hurt","/world/europe/kosovo-serbian-unrest-continues-north-2023-05-30/","here","https://www.thomsonreuters.com/en/about-us/trust-principles.html","The Thomson Reuters Trust Principles.",,,,,,,,,,,,,,,"reuters.com","https://www.reuters.com/world/europe/nato-soldiers-guard-kosovo-serb-town-following-clashes-2023-05-30/","Reuters","https://www.reuters.com/world/",,"NATO soldiers on guard in Kosovo town, Serb protesters smash two cars","https://www.reuters.com/world/","LEPOSAVIC, Kosovo, May 30 (Reuters) - Serbian protesters smashed two cars belonging to journalists in Kosovo's Leposavic town on Tuesday, a day after 30 NATO soldiers and 52 protesters were hurt in clashes, as EU and NATO officials urged a de-escalation of the violence.

Unrest in the region has intensified since ethnic Albanian mayors took office in northern Kosovo's Serb-majority area after April elections that the Serbs boycotted, a move that led the U. S. and its allies to rebuke Pristina on Friday.

NATO said in a statement it would send additional forces to Kosovo to curb the violence, adding it ""has directed the deployment of the Operational Reserve Forces (ORF) for the Western Balkans.""

Masked men smashed the windshield of a car with an Albanian licence plate marked as ""A2, CNN affiliate,"" a Reuters reporter who witnessed the incident said. A separate car belonging to another media outlet was smashed as well. No one was injured.

EU foreign policy chief Josep Borrell urged Kosovo and Serbian leaders to find a way to de-escalate tensions through dialogue.

""We have too much violence already in Europe today, we cannot afford another conflict,"" Borrell told a news briefing in Brussels.

Northern Kosovo's majority Serbs have never accepted Kosovo's 2008 declaration of independence from Serbia, and consider Belgrade their capital more than two decades after the Kosovo Albanian uprising against repressive Serbian rule.

Ethnic Albanians make up more than 90% of the population in Kosovo as a whole, but northern Serbs have long demanded the implementation of an EU-brokered 2013 deal for the creation of an association of autonomous municipalities in their area.

Serbs refused to take part in local elections in April and ethnic Albanian candidates won the mayoralties in four Serb-majority municipalities with a 3.5% turnout.

Russia, which has long had close ties with Serbia and shares its Slavic and Orthodox Christian traditions, called on Tuesday for ""decisive steps"" to quell the unrest in Kosovo.

The Russian foreign ministry urged ""the West to finally silence its false propaganda and stop blaming incidents in Kosovo on Serbs driven to despair, who are peaceful, unarmed, trying to defend their legitimate rights and freedoms.""

Several ethnic Serbs gathered in front of the municipal building in the town of Zvecan on Tuesday, where the situation was calm, with soldiers from the United States, Italy and Poland standing by in anti-riot gear.

The Serbian protestors will disperse at 4 p.m. (1400 GMT), and return on Wednesday morning, the Serbian Tanjug news agency reported, citing Serbian officials in Zvecan.

Kosovo authorities have blamed Serbian President Aleksandar Vucic for destabilising Kosovo. Vucic blames Kosovo authorities for causing problems by installing new mayors.

""In a democracy there is no place for fascist violence—no appeal from ballot to bullet,"" Kosovo Prime Minister Albin Kurti said on Twitter late on Monday.

After meeting ambassadors of the Quint group - comprising the United States, Italy, France, Germany and Britain - in Belgrade, Vucic said he had asked that Albanian mayors are removed from their offices in the north.

Kosovo President Vjosa Osmani said criminal gangs, supported by Vucic, aimed to destabilize Kosovo and the entire region.

On Monday, Serb protesters in Zvecan threw tear gas and stun grenades at NATO soldiers, leaving 30 NATO troops hurt, along with 52 Serbs.

""Violent acts against citizens, against media, against law enforcement and KFOR (NATO's Kosovo) troops are absolutely unacceptable,"" EU's Borrell said.

For a TIMELINE on Serbian unrest in north Kosovo, click here.","NATO soldiers on guard in Kosovo town, Serb protesters smash two cars","https://www.reuters.com/world/europe/nato-soldiers-guard-kosovo-serb-town-following-clashes-2023-05-30/"
