"author/0","canonicalLink","copyright","date","depth","description","favicon","image","keywords","lang","links/0/href","links/0/text","links/1/href","links/1/text","links/2/href","links/2/text","links/3/href","links/3/text","links/4/href","links/4/text","links/5/href","links/5/text","links/6/href","links/6/text","links/7/href","links/7/text","loadedDomain","loadedUrl","publisher","referrer","screenshotUrl","softTitle","startUrl","tags/0","tags/1","tags/2","text","title","url"
"Reuters","https://www.reuters.com/world/us/that-70s-show-actor-danny-masterson-convicted-two-rape-counts-2023-05-31/","2023 Reuters","2023-06-01T12:00:00.000Z","1","""That '70s Show"" actor Danny Masterson was convicted on Wednesday of raping two women at his Hollywood Hills home.","/pf/resources/images/reuters/favicon/favicon.ico?d=143","https://www.reuters.com/resizer/d5vzqp0FgfHL-mYbUz6sRw58RUc=/1200x628/smart/filters:quality(80)/cloudfront-us-east-2.images.arcpublishing.com/reuters/B2OVZZXIOZMJRHZBHV3QQM7L4E.jpg","NRLPA:OCRIM,MTVID,MTPIX,CLEB,CLJ,CRIM,ENT,GEN,PRO,PXP,SCRIM,TELE,TOPNWS,NRLPA:OLIT,LEGAL,REUTERS-LEGAL","en","https://www.thomsonreuters.com/en/about-us/trust-principles.html","The Thomson Reuters Trust Principles.",,,,,,,,,,,,,,,"reuters.com","https://www.reuters.com/world/us/that-70s-show-actor-danny-masterson-convicted-two-rape-counts-2023-05-31/","Reuters","https://www.reuters.com/world/us",,"'That 70s Show' actor Danny Masterson convicted on two rape counts","https://www.reuters.com/world/us",,,,"May 31 (Reuters) - ""That '70s Show"" actor Danny Masterson was convicted on Wednesday of raping two women at his Hollywood Hills home.

A jury deadlocked on another charge that Masterson raped a third woman between 2001 and 2003, according to Greg Risling, a spokesperson for the Los Angeles County District Attorney's office.

Masterson, 47, got his break-out role in the 1998 to 2006 television comedy series ""That '70s Show,"" in which he played a rebel adolescent.

The actor had pleaded not guilty to the rape charges.

Defense attorney Philip Cohen had urged jurors to acquit his client. According to City News Service, Cohen questioned the credibility of the alleged victims and said their stories had been tweaked over the years.

The case drew attention in part because Masterson met the women through the Church of Scientology, and two of the accusers said the organization discouraged them from contacting law enforcement.

The Church of Scientology has rejected that claim.

""The church has no policy prohibiting or discouraging members from reporting criminal conduct of anyone, Scientologists or not, to law enforcement,"" according to a statement cited by City News Service.","'That 70s Show' actor Danny Masterson convicted on two rape counts","https://www.reuters.com/world/us/that-70s-show-actor-danny-masterson-convicted-two-rape-counts-2023-05-31/"
"Thomson Reuters","https://www.reuters.com/world/us/jpmorgan-says-dimon-never-had-discussions-with-former-executive-over-epstein-2023-05-31/","2023 Reuters","2023-05-31T12:00:00.000Z","1","A former JPMorgan Chase & Co executive wrote in a 2011 email that the late financier and sex offender Jeffrey Epstein should not be a client of the bank, according to a transcript of a deposition of Chief Executive Jamie Dimon seen by Reuters.","/pf/resources/images/reuters/favicon/favicon.ico?d=143","https://www.reuters.com/resizer/AzL6ojdT1uQu-TGB7aIL7bKGYnI=/1200x628/smart/filters:quality(80)/cloudfront-us-east-2.images.arcpublishing.com/reuters/JIDXI7QD2JJKDEOWLXCHAKPHWQ.jpg","NRLPA:OCRIM,BACT,BISV,BISV08,BIZ,BLR,BNK,BNKS,BNKS1,BSVC,CMPNY,FIN,FINS,FINS08,NEWS1,PUBL,AMERS,US,NAMER,MTPIX,CLJ,GEN,JUDIC,PXP,LEGAL,REUTERS-LEGAL,NRLPA:OCOG,NRLPA:OLIT,RSBI:ESG-INVESTORS,RSBI:SOCIAL-IMPACT,TOPNWS,ESG,ESGSOC,MNGISS,TOPCMB,VI,CARIBN,LATAM","en","https://www.reuters.com/companies/JPM.N","(JPM.N)","https://www.thomsonreuters.com/en/about-us/trust-principles.html","The Thomson Reuters Trust Principles.",,,,,,,,,,,,,"reuters.com","https://www.reuters.com/world/us/jpmorgan-says-dimon-never-had-discussions-with-former-executive-over-epstein-2023-05-31/","Reuters","https://www.reuters.com/world/us",,"Ex-JPMorgan executive wrote Epstein 'should not be a client' in 2011 email -deposition","https://www.reuters.com/world/us",,,,"[1/2] A view of the exterior of the JP Morgan Chase & Co. corporate headquarters in New York City May 20, 2015. REUTERS/Mike Segar

[1/2] A view of the exterior of the JP Morgan Chase & Co. corporate headquarters in New York City May 20, 2015. REUTERS/Mike Segar

NEW YORK, May 31 (Reuters) - A former JPMorgan Chase & Co (JPM. N) executive wrote in a 2011 email that the late financier and sex offender Jeffrey Epstein should not be a client of the bank, according to a transcript of a deposition of Chief Executive Jamie Dimon seen by Reuters.

Dimon said in the deposition he was not aware of the email at the time but ""I know it today.""

Dimon also said that if the bank had known in the past what is known today about Epstein - citing, in particular, his arrest in 2019 and the 2020 conviction of his longtime associate Ghislaine Maxwell on charges including sex trafficking - that he would have been terminated as a client.

The largest U. S. bank faces lawsuits seeking damages by women who claim that Epstein sexually abused them, and by the U.S. Virgin Islands, where the late financier had a home.

Epstein was a JPMorgan client from 2000 to 2013, remaining so after pleading guilty in 2008 to a Florida state prostitution charge.

In Dimon's May 26 deposition, he was asked about the email former general counsel Stephen Cutler sent to other executives, including former private banking chief Jes Staley and Mary Erdoes, now head of asset and wealth management, calling Epstein ""not a person we should do business with, period.""

""This is not an honorable person in any way,"" Cutler wrote. ""He should not be a client.""

The email was read by a lawyer for the Virgin Islands during questioning, according to the transcript. Reuters has not seen the email itself.

""Had the firm believed he was engaged in an ongoing sex trafficking operation, Epstein would not have been retained as a client,"" a JPMorgan spokesperson said in a statement. ""In hindsight, we regret he was ever a client.""

Cutler did not immediately respond to a request for comment.

David Boies, a lawyer for the woman known as Jane Doe who is suing the bank, said in a statement that the deposition ""confirms that people at the hugest level within JP Morgan, including its general counsel, recognized that the bank was complicit in providing banking services to Epstein, but nevertheless continued to do so.""

In the deposition, Dimon also repeatedly denied speaking about Epstein with Staley, who was friendly with Epstein. The bank is suing Staley, arguing he should be held liable for any damages JPMorgan is forced to pay for concealing what he knew about Epstein.

Staley has said he regrets his friendship with Epstein, but denied knowing about Epstein's alleged sex trafficking. His lawyers did not immediately respond to a request for comment on Wednesday.

The New York Times reported on Wednesday that Erdoes said during a March deposition that she decided to dismiss Epstein as a client in 2013 because of concerns about large withdrawals from his accounts.

During the deposition, Dimon said he trusted both Erdoes and Cutler and thought they were ""trying to do the right thing,"" according to the transcript.

Epstein died in 2019 in a Manhattan jail cell while awaiting trial on sex trafficking charges. New York City's medical examiner called the death a suicide.","Ex-JPMorgan executive wrote Epstein 'should not be a client' in 2011 email -deposition","https://www.reuters.com/world/us/jpmorgan-says-dimon-never-had-discussions-with-former-executive-over-epstein-2023-05-31/"
"By David Lawder","https://www.reuters.com/world/us/us-debt-ceiling-deal-dooms-bidens-revolutionary-tax-plans-2023-06-01/","2023 Reuters","2023-06-01T12:00:00.000Z","1","U.S. President Joe Biden's 2020 campaign promise to make wealthy Americans and corporations pay more in taxes to finance a range of social priorities breathed its last gasp, at least for this presidential term, with the debt ceiling deal he struck with Republicans on Saturday.","/pf/resources/images/reuters/favicon/favicon.ico?d=143","https://www.reuters.com/resizer/FRQshHVTlWDQawwdm5ShEjgluh8=/1200x628/smart/filters:quality(80)/cloudfront-us-east-2.images.arcpublishing.com/reuters/QSMKVZFLIZNQ7IZTDVBTJLUWTE.jpg","ANV,MTPIX,EREP,TOPNWS,ANLINS,CEN,CLJ,DBT,ECI,ECO,FED,GBR,GEN,GFIN,GVD,HREP,LAW,MCE,NEWS1,POL,POTUS,PXP,SEN,TAX,TOPCMB,WASH,AMERS,US,NAMER,ECON","en","/markets/us/whats-debt-ceiling-deal-biden-mccarthy-are-negotiating-2023-05-26/","deal to cap discretionary spending","/world/us/many-republican-voters-agree-with-biden-trickle-down-economics-has-failed-2021-04-29/","Polls show the idea of fighting glaring income inequality with tax increases on the wealthy","https://www.reuters.com/graphics/USA-BIDEN/INVESTMENTS/xlbvgkbxlvq/","&quot;Build Back Better&quot;","https://tax.thomsonreuters.com/news/refresher-infrastructure-and-investment-jobs-acts-crypto-reporting-requirements/","new cryptocurrency","/markets/us/how-could-new-us-corporate-minimum-tax-affect-companies-2022-08-10/","corporate alternative minimum tax","https://www.oecd.org/tax/revenue-statistics-united-states.pdf","as a percentage of GDP","https://www.cbo.gov/system/files/2023-05/59154-Budgetary-Outcomes.pdf","estimates","https://www.thomsonreuters.com/en/about-us/trust-principles.html","The Thomson Reuters Trust Principles.","reuters.com","https://www.reuters.com/world/us/us-debt-ceiling-deal-dooms-bidens-revolutionary-tax-plans-2023-06-01/","Reuters","https://www.reuters.com/world/us",,"Analysis: US debt-ceiling deal dooms Biden's revolutionary tax plans","https://www.reuters.com/world/us",,,,"WASHINGTON, June 1 (Reuters) - U. S. President Joe Biden's 2020 campaign promise to make wealthy Americans and corporations pay more in taxes to finance a range of social priorities breathed its last gasp, at least for this presidential term, with the debt ceiling deal he struck with Republicans on Saturday.

The deal to cap discretionary spending and suspend the debt ceiling contains no tax rate changes to raise revenue; it also slashes new funding Biden had allocated to the hollowed-out Internal Revenue Service. The agreement caps Republicans' successful defense of the debt-boosting 2017 Trump tax cuts against withering criticism from Biden and several attempts by his Democrats to reverse them for wealthy Americans.

Barring an unlikely Democratic sweep of the White House and both chambers of Congress in 2024, major changes to the U. S. tax code are now seen as largely off the table until the end of 2025, when the 2017 individual tax cuts expire. Then, tax experts predict lawmakers will be forced to agree on a major tax revamp.

""Things are getting set up for a big fiscal cliff in 2025. That's the next opportunity for major changes,"" said William McBride, vice president of federal tax policy for the Tax Foundation, a conservative think tank in Washington.

Polls show the idea of fighting glaring income inequality with tax increases on the wealthy and corporations is hugely popular with Democratic and Republican voters.

Biden's unrealized campaign tax pledges illustrate the political difficulty of changing the U. S. tax code, barring a commanding majority in Congress.

His $4 trillion, two-part ""Build Back Better"" plan included infrastructure, clean energy incentives, workforce development, child care, paid family leave, free community college, expanded child tax credits and other initiatives.

He proposed over $3.5 trillion in new taxes, including raising the corporate rate to 28% from 21% and returning the top individual rate to 39.6% from 37% and taxing capital gains at those rates for Americans earning over $1 million. He promised no increases for those earning under $400,000 a year.

But opposition from Republicans and Democratic senators Joe Manchin and Kyrsten Sinema, now an Independent, forced Biden to scale back his revenue plans. He did manage to win new cryptocurrency tax reporting rules in the infrastructure bill and a new 15% corporate alternative minimum tax in the climate-focused Inflation Reduction Act, to achieve $238 billion in deficit cuts over 10 years.

Biden presented his tax hikes and social agenda one last time, largely for campaign purposes, in his fiscal 2024 budget request in March, proposing to raise $5.5 trillion in new revenue and cutting deficits by $3 trillion over a decade.

But in the debt-ceiling negotiations, the president did not insist on tax revenue-raisers, and sacrificed part of his revenue crown jewel - $80 billion in new funding over a decade to modernize the IRS to beef up enforcement against tax cheats. The IRS will cede $20 billion over two years to other spending priorities.

""House Republicans have successfully blocked every penny of President Biden’s tax hikes on families, farmers, and small businesses in the debt ceiling deal and protected the 2017 Tax Cuts and Jobs Act from repeal,"" said U. S. House Ways and Means Chairman Jason Smith.

The Missouri Republican added that Americans want Congress to build on the Trump tax cuts ""with more tax relief.""

The 2024 presidential election is already becoming a new battle ground over taxes as both parties posture over the expiration of 2017 individual tax cuts and the overall level of taxation in the economy.

U. S. taxes are low compared with other wealthy countries, ranking 32nd out of 38 Organisation for Economic Co-operation and Development countries as a percentage of GDP, with a 2021 ratio of 26.8% - well below the group's 34.1% average.

White House spokesperson Michael Kikukawa said Biden would continue pushing Congress to make the ""super-wealthy and biggest corporations"" pay their fair share in taxes.

""This agenda is overwhelmingly popular with bipartisan majorities of the American people, and would reduce the deficit by trillions of dollars without raising taxes a penny on those making less than $400,000,"" Kikukawa said.

Republicans will argue for making the 2017 individual tax cuts permanent, said John Gimigliano, KPMG's head of federal tax legislative and regulatory services.

The Congressional Budget Office estimates this would add $2.8 trillion to its baseline deficit forecast just through 2033 compared with letting them expire under current law.

Democrats will advocate ""a return to Build Back Better and see a push on the corporate rate, on the capital gains rate and individual rates and all the things they had hoped to do,"" Gimigliano said.

Steve Rosenthal, a senior fellow at the left-leaning Urban-Brookings Tax Policy Center in Washington, said it may be difficult for Biden to reprise his ""very powerful"" 2020 tax agenda.

""Very little of it was accomplished in the Inflation Reduction Act, and nothing was advanced as part of these debt ceiling negotiations,"" Rosenthal said. ""So how credible will Biden be running on a platform of closing loopholes and raising taxes on the rich and corporations?""","US debt-ceiling deal dooms Biden's revolutionary tax plans","https://www.reuters.com/world/us/us-debt-ceiling-deal-dooms-bidens-revolutionary-tax-plans-2023-06-01/"
"Thomson Reuters","https://www.reuters.com/world/us/failed-republican-candidate-charged-shooting-spree-aimed-new-mexico-democrats-2023-05-31/","2023 Reuters","2023-06-01T12:00:00.000Z","1","A failed Republican state candidate in New Mexico was charged by federal authorities on Wednesday for a shooting spree targeting the homes of four elected Democratic officials, the U.S. Justice Department said in a statement.","/pf/resources/images/reuters/favicon/favicon.ico?d=143","https://www.reuters.com/resizer/Oj1QUiWMvCLV_crG-jVAtfzGiXI=/1200x628/smart/filters:quality(80)/cloudfront-us-east-2.images.arcpublishing.com/reuters/CEHANQLL5ZNU3M6DE5IPMKKKFI.jpg","NRLPA:OCRIM,MTPIX,CLJ,CRIM,GEN,JUDIC,MURD,POL,VOTE,VOTH,AMERS,US,USANM,NAMER,LEGAL,REUTERS-LEGAL,TOPNWS","en","https://reut.rs/3C6pFQ6","shootings","https://reut.rs/3MLPQAo","David Clements","https://www.thomsonreuters.com/en/about-us/trust-principles.html","The Thomson Reuters Trust Principles.",,,,,,,,,,,"reuters.com","https://www.reuters.com/world/us/failed-republican-candidate-charged-shooting-spree-aimed-new-mexico-democrats-2023-05-31/","Reuters","https://www.reuters.com/world/us",,"Failed Republican candidate charged in shooting spree aimed at New Mexico Democrats","https://www.reuters.com/world/us",,,,"May 31 (Reuters) - A failed Republican state candidate in New Mexico was charged by federal authorities on Wednesday for a shooting spree targeting the homes of four elected Democratic officials, the U. S. Justice Department said in a statement.

Solomon Pena, 40, lost a state House of Representatives race last November. After his defeat, Pena organized the shootings on the homes of two Bernalillo County commissioners and two New Mexico state legislators, prosecutors said.

The shootings, one of which involved a machine gun, were carried out between Dec. 4, 2022, and Jan. 3, 2023, with assistance from co-conspirators, the Justice Department said. The federal indictment was unsealed Wednesday in the District of New Mexico.

""There is no room in our democracy for politically motivated violence, especially when it is used to undermine election results,"" said Assistant Attorney General Kenneth Polite Jr. of the Justice Department’s criminal division.

If convicted, Pena faces a mandatory minimum of 60 years in prison, according to the Justice Department.

Pena, described as a ""radical right election denier"" by Albuquerque Mayor Tim Keller, was arrested in January and charged by local county prosecutors with contracting four gunmen to shoot at the homes of the Democratic officials after he visited them to dispute his 2022 election defeat.

There were no fatalities in the shootings, which followed sometimes heated arguments as Pena visited the homes of three county commissioners and state Senator Linda Lopez to allege fraud in a House race he lost by 47 percentage points, police had said.

Pena is a supporter of false theories spread by prominent New Mexico-based election denier David Clements, according to Pena's website and messages in a Telegram group run by Clements' wife.","Failed Republican candidate charged in shooting spree aimed at New Mexico Democrats","https://www.reuters.com/world/us/failed-republican-candidate-charged-shooting-spree-aimed-new-mexico-democrats-2023-05-31/"
"Thomson Reuters","https://www.reuters.com/world/us/three-accused-harassing-chinese-fugitive-us-head-trial-2023-05-31/","2023 Reuters","2023-05-31T12:00:00.000Z","1","A former New York City police sergeant charged with acting as an illegal Chinese agent for allegedly intimidating a U.S.-based fugitive from China went on trial on Wednesday and argued he did not know that country's government was behind a private surveillance job he took.","/pf/resources/images/reuters/favicon/favicon.ico?d=143","https://www.reuters.com/resizer/G7hXVVkuD4gkDIikZRggkeQcUk4=/1200x628/smart/filters:quality(80)/cloudfront-us-east-2.images.arcpublishing.com/reuters/XYRBDY43HZLWVMRTSLJIXC2HNM.jpg","NRLPA:OCRIM,BRIB,CLJ,CRIM,DIP,FRAUD1,GEN,JUDIC,POL,EASIA,AMERS,US,NAMER,ASXPAC,EMRG,CN,ASIA,LEGAL,REUTERS-LEGAL,NRLIN:OGOV,NRLPA:OLIT,RSBI:HUMAN-RIGHTS,MTPIX,CIV,CWP,HRGT,SECUR,TOPNWS,TOPCMB,USCNYC,USANY,USANJ","en","https://www.thomsonreuters.com/en/about-us/trust-principles.html","The Thomson Reuters Trust Principles.",,,,,,,,,,,,,,,"reuters.com","https://www.reuters.com/world/us/three-accused-harassing-chinese-fugitive-us-head-trial-2023-05-31/","Reuters","https://www.reuters.com/world/us",,"Chinese agent or private eye? Ex-NY cop's 'Fox Hunt' trial kicks off","https://www.reuters.com/world/us",,,,"[1/4] Michael McMahon, a retired NYPD sergeant working as a private investigator, arrives for the start of his trial on charges related to a global repatriation campaign by Chinese law enforcement known as ‘Operation Fox Hunt,’ at Brooklyn federal court in Brooklyn, New York, U. S., May 31, 2023. ... Read more

[1/4] Michael McMahon, a retired NYPD sergeant working as a private investigator, arrives for the start of his trial on charges related to a global repatriation campaign by Chinese law enforcement known as ‘Operation Fox Hunt,’ at Brooklyn federal court in Brooklyn, New York, U. S., May 31, 2023. ... Read more

NEW YORK, May 31 (Reuters) - A former New York City police sergeant charged with acting as an illegal Chinese agent for allegedly intimidating a U. S.-based fugitive from China went on trial on Wednesday and argued he did not know that country's government was behind a private surveillance job he took.

Federal prosecutors in Brooklyn say Michael McMahon pressured a New Jersey resident, Xu Jin, to return to China to face bribery and embezzlement charges, one example of a global repatriation campaign by Chinese law enforcement known as ""Operation Fox Hunt.""

The case is the first of several involving alleged Fox Hunt schemes to reach trial in the United States, as officials crack down on what they term ""transnational repression"" on dissidents and fugitives by adversaries including China.

McMahon is on trial alongside Zhu Yong, who prosecutors say hired him for the job in 2016, and Zheng Congying, who is accused of posting a note to Xu's door in 2018 reading: ""If you are willing to go back to the mainland and spend 10 years in prison, your wife and children will be all right.""

All three men have pleaded not guilty to charges of acting as Chinese agents without notifying the U. S. attorney general, as required by law, and interstate stalking.

Liu Pengyu, a spokesperson for the Chinese Embassy in Washington, said the individuals on trial are not Chinese law enforcement and called the charges ""nothing but rumors and slanders.""

""Repatriating corrupt fugitives and recovering illegal proceeds are a just cause widely recognized by the international community,"" Liu said in a statement.

In his opening statement before a federal jury, McMahon's lawyer, Lawrence Lustberg, said his client was told he was working for a Chinese construction company trying to recover assets, and alerted local law enforcement to his activities.

""If he's secretly acting on behalf of the Chinese government, is he going to call the cops and tell them?"" Lustberg said. ""He had no idea, none ... that he was working for China.""

Irisa Chen, a prosecutor, said McMahon searched the target's name on the internet and even met a Chinese official during the course of his work, suggesting he saw through the ""vague"" cover story.

""McMahon knew this was not the true reason,"" Chen said in her opening statement. ""He looked the other way.""

Lawyers for Zhu and Zheng, both Chinese citizens and New York City residents, said their clients also did not know they were working for China's government.

Xu had directed the municipal development division of the Chinese city of Wuhan before being charged with taking millions of dollars in bribes, according to a 2021 ProPublica investigation.

In her opening statement, Chen did not refer to Xu by name, referring to him only as a former Chinese government official who came to the United States in 2010 after falling out of favor with the ruling Chinese Communist Party. China's government then put out an international notice for his arrest, Chen said.

Xu was identified by name by the first witness, his sister-in-law Liu Yan. She testified that at two separate points in 2016, individuals she did not know came to her Short Hills, New Jersey, home and told her that Xu should go back to China.

""I felt very scared,"" she said.

Then, in early 2017, Xu's elderly father, who lived in China and did not know her U. S. address, showed up unannounced at Liu's home and told her he had a ""task"" to persuade Xu to go back to China.

Chen said in her opening statement that Xu's father was being used as ""bait.""

""I cannot believe the law enforcement of China's government was using an elderly man to meet their goal,"" Liu testified.","Chinese agent or private eye? Ex-NY cop's 'Fox Hunt' trial kicks off","https://www.reuters.com/world/us/three-accused-harassing-chinese-fugitive-us-head-trial-2023-05-31/"
