"author/0","canonicalLink","copyright","date","depth","description","favicon","image","keywords","lang","links/0/href","links/0/text","links/1/href","links/1/text","links/2/href","links/2/text","links/3/href","links/3/text","links/4/href","links/4/text","links/5/href","links/5/text","links/6/href","links/6/text","links/7/href","links/7/text","links/8/href","links/8/text","links/9/href","links/9/text","links/10/href","links/10/text","links/11/href","links/11/text","links/12/href","links/12/text","loadedDomain","loadedUrl","publisher","referrer","screenshotUrl","softTitle","startUrl","text","title","url"
"Thomson Reuters","https://www.reuters.com/world/europe/drones-hit-several-buildings-moscow-mayor-2023-05-30/","2023 Reuters","2023-05-30T12:00:00.000Z","1","President Vladimir Putin said on Tuesday that Ukraine's biggest ever drone strike on Moscow was an attempt to scare and provoke Russia, and air defences around the capital would be strengthened.","/pf/resources/images/reuters/favicon/favicon.ico?d=143","https://www.reuters.com/resizer/KyAkVXdBvSl6XRjdhFoKS2IF4mM=/1200x628/smart/filters:quality(80)/cloudfront-us-east-2.images.arcpublishing.com/reuters/F7ILQRGJOVPKVN47B2DZMRQE6Y.jpg","REPI:GRID-INFRASTRUCTURE,CWP,DEF,DIP,EU,GEN,INTAG,NATO,NEWS1,NUCL,POL,SECUR,WAR,CEEU,AMERS,US,EUROP,UA,RU,NASIA,NAMER,ASXPAC,CISC,EMRG,ASIA,TOPNWS,TOPCMB,EEU,MTVID,MTPIX,AER,AERO,CCOS,COM,CYCS,CYCS08,DRONEM,ENR,INDG,INDG08,INDS,INDS08,MDIA,MDIA08,NRG,PPL,PUB,TMT,TNPT","en","/world/europe/drone-war-comes-russia-muscovites-shrug-their-shoulders-carry-2023-05-30/","Muscovites carried on with their lives","https://www.thomsonreuters.com/en/about-us/trust-principles.html","The Thomson Reuters Trust Principles.",,,,,,,,,,,,,,,,,,,,,,,"reuters.com","https://www.reuters.com/world/europe/drones-hit-several-buildings-moscow-mayor-2023-05-30/","Reuters","https://www.reuters.com/world/",,"Putin says Ukraine drone strikes on Moscow aim to scare and provoke Russia","https://www.reuters.com/world/","MOSCOW, May 30 (Reuters) - President Vladimir Putin said on Tuesday that Ukraine's biggest ever drone strike on Moscow was an attempt to scare and provoke Russia, and air defences around the capital would be strengthened.

Russia said eight drones targeted civilian areas of Moscow and the Moscow region - with a population of over 21 million - in the early hours of Tuesday but were either shot down or diverted with special electronic jammers.

Putin cast the assault, which brought the 15-month war in Ukraine to the heart of Russia, as a terrorist response that came after Russia struck at Ukraine's military intelligence headquarters several days ago.

Ukraine, Putin said, had chosen the path of attempting ""to intimidate Russia, Russian citizens and attacks on residential buildings"".

""This is clearly a sign of terrorist activity,"" he said.

Air defences around Moscow - which as the capital of the world's biggest nuclear power is already protected by an extensive early warning system - would be strengthened, he said.

A Ukrainian presidential aide denied Kyiv was directly involved in the Moscow attack, but said Ukraine was enjoying watching events and forecast more to come.

""Of course we are pleased to watch and predict an increase in the number of attacks. But of course we have nothing directly to do with this,"" Ukrainian presidential adviser Mykhailo Podolyak said.

There is little sign of peace in one of the deadliest wars in Europe since World War Two, and Moscow has repeatedly warned that the West is escalating the war by supplying Kyiv with so much weaponry.

Drone attacks deep inside Russia have intensified in recent weeks with strikes on oil pipelines and even the Kremlin earlier this month. Ukraine denied the Kremlin attack but The New York Times reported that U. S. intelligence believes Kyiv was responsible.

Drone debris hit some of Moscow's most prestigious areas including Leninsky Prospekt, a grand avenue crafted under Josef Stalin, and the area of western Moscow where the Russian elite - including Putin - have their residences.

Residents in south-western Moscow said they heard loud bangs at around 0200 to 0300 GMT, followed by the smell of petrol. Some filmed a drone being shot down and a plume of smoke rising over the Moscow skyline.

Moscow Mayor Sergei Sobyanin said two people were injured, one of whom was hospitalised, in the early morning attack. Moscow's airports remained open. No deaths were reported.

So far Putin has kept the war in Ukraine far from Moscow, where life has continued relatively normally despite the biggest rupture in Russia's ties with the West since the 1962 Cuban Missile Crisis.

Russia began attacking the Ukrainian capital with swarms of cheaply produced loitering munitions often known as “kamikaze drones” last October and uses them extensively during its regular air strikes across Ukraine.

Prosecutors said incidents occurred in the Odintsovsky District of western Moscow region - where Putin has his Novo-Ogaryovo state residence. The area, the most expensive in Russia, is the home to the country's elite.

Russian state television gave the attacks calm coverage. Many Muscovites carried on with their lives with the fatalism for which they are famous.

On a warm spring day in the city centre, residents could be seen taking selfies in front of the Bolshoi Theatre while others relaxed in cafes and shopped in the well-stocked luxury stores of Moscow.

Putin has repeatedly cast the conflict in Ukraine as a struggle with what he says is an arrogant and aggressive West which is risking a global war by supporting Ukraine.

Thus far, the war has been described by the Kremlin as a ""special military operation"". The United States has repeatedly said it does not want a war with Russia and has said Ukraine should not use Western weapons to attack inside Russia.

Russian lawmakers cautioned that there were likely to be more attacks on Moscow, which many said would make it necessary to give the military and security agencies even greater powers.

""The sabotage and terrorist attacks of Ukraine will only increase,"" said Alexander Khinshtein, from the ruling United Russia bloc.

""It is necessary to radically strengthen defence and security measures, especially in terms of countering drones. This includes finally passing the necessary laws.""","Putin says Ukraine drone strikes on Moscow aim to scare and provoke Russia","https://www.reuters.com/world/europe/drones-hit-several-buildings-moscow-mayor-2023-05-30/"
"Reuters","https://www.reuters.com/world/russias-lavrov-accuses-west-supporting-genocide-ukraine-2023-05-30/","2023 Reuters","2023-05-30T12:00:00.000Z","1","Russian Foreign Minister Sergei Lavrov said on Tuesday that the West was ""supporting genocide"" in Ukraine through its backing for President Volodymyr Zelenskiy's peace plan, which he claimed would ""destroy everything Russian"" in east Ukraine and Crimea.","/pf/resources/images/reuters/favicon/favicon.ico?d=143","https://www.reuters.com/resizer/30AQF61_CzZ-S0Xq16mrI7nhUh0=/1200x628/smart/filters:quality(80)/cloudfront-us-east-2.images.arcpublishing.com/reuters/WKK743MP4VM57BSA2DCGATD65E.jpg","CWP,DIP,GEN,NEWS1,POL,SECUR,WAR,CEEU,EUROP,UA,RU,NASIA,ASXPAC,CISC,EMRG,ASIA,EEU","en","/world/europe/drones-hit-several-buildings-moscow-mayor-2023-05-30/","launching","/world/europe/russia-puts-us-senator-graham-wanted-list-russian-media-2023-05-29/","edited video","https://www.thomsonreuters.com/en/about-us/trust-principles.html","The Thomson Reuters Trust Principles.",,,,,,,,,,,,,,,,,,,,,"reuters.com","https://www.reuters.com/world/russias-lavrov-accuses-west-supporting-genocide-ukraine-2023-05-30/","Reuters","https://www.reuters.com/world/",,"Russia's Lavrov accuses West of 'supporting genocide' in Ukraine","https://www.reuters.com/world/","May 30 (Reuters) - Russian Foreign Minister Sergei Lavrov said on Tuesday that the West was ""supporting genocide"" in Ukraine through its backing for President Volodymyr Zelenskiy's peace plan, which he claimed would ""destroy everything Russian"" in east Ukraine and Crimea.

Lavrov, speaking during a trip to Africa, did not offer evidence to support his claim. Russia has long accused the West of ignoring what it says is Ukrainian persecution of Russian language speakers in the eastern Donbas region and elsewhere.

""The conclusion is very simple - the West directly supports genocide,"" Lavrov said during a press conference with his Burundian counterpart.

Zelenskiy's peace plan envisages the withdrawal of Russian forces from all Ukrainian territory, including the Crimea peninsula, which Moscow forcibly annexed in 2014.

Speaking on the day when Russia accused Ukraine of launching its biggest ever drone attack on Moscow, Lavrov said the West was directly helping Kyiv to carry out such ""terrorist"" strikes by providing it with weapons and military equipment.

""The statement of the West that the weapons it is supplying (to Ukraine) must not be used against the territory of the Russian Federation is just another lie,"" he said.

Lavrov also took aim at comments by U. S. Senator Lindsey Graham, saying they could be understood as encouraging the killing of Russians.

In an edited video released by Zelenskiy's office last Friday, Graham was shown saying during a meeting with the Ukrainian president in Kyiv that ""the Russians are dying"" and then saying U. S. support was the ""best money we've ever spent"".

After Russia criticised the remarks, Ukraine released a full video of the meeting on Sunday which showed the two remarks were not directly linked.

Graham said he had simply praised the spirit of Ukrainians in resisting a Russian invasion with assistance provided by Washington.","Russia's Lavrov accuses West of 'supporting genocide' in Ukraine","https://www.reuters.com/world/russias-lavrov-accuses-west-supporting-genocide-ukraine-2023-05-30/"
"Reuters","https://www.reuters.com/world/india/indian-athletes-toss-medals-into-ganges-they-demand-officials-arrest-2023-05-30/","2023 Reuters","2023-05-30T12:00:00.000Z","1","India's top wrestlers have threatened to hurl their medals into the river Ganges on Tuesday as they demand the arrest of the head of the Wrestling Federation of India over sexual harassment allegations.","/pf/resources/images/reuters/favicon/favicon.ico?d=143","https://www.reuters.com/resizer/b4cXz3wmvWJlo2xfved70Hcy9XY=/1200x628/smart/filters:quality(80)/cloudfront-us-east-2.images.arcpublishing.com/reuters/CSGSCQEEORNNLFBEODVNMJ4KNM.jpg","CLJ,CRIM,CWP,GEN,SCRIM,SPO,VIO,WRE,WRES,WSPO,SASIA,IN,ASXPAC,EMRG,ASIA","en","/sports/top-indian-wrestlers-detained-protest-against-federation-chief-intensifies-2023-05-28/","detained","https://www.thomsonreuters.com/en/about-us/trust-principles.html","The Thomson Reuters Trust Principles.",,,,,,,,,,,,,,,,,,,,,,,"reuters.com","https://www.reuters.com/world/india/indian-athletes-toss-medals-into-ganges-they-demand-officials-arrest-2023-05-30/","Reuters","https://www.reuters.com/world/",,"Indian athletes to toss medals into Ganges as they demand official's arrest","https://www.reuters.com/world/","NEW DELHI, May 30 (Reuters) - India's top wrestlers have threatened to hurl their medals into the river Ganges on Tuesday as they demand the arrest of the head of the Wrestling Federation of India over sexual harassment allegations.

The wrestlers had been camping in New Delhi since April 23 demanding action against Wrestling Federation of India (WFI) President Brij Bhushan Sharan Singh, who has denied any wrongdoing.

Singh, a member of parliament for Prime Minister Narendra Modi's ruling Bharatiya Janata Party, could not be reached for comment on Tuesday.

Several of the protesting wrestlers were briefly detained by Delhi Police on Sunday and their camp site was cleared after they tried to move towards India's new parliament building.

Singh has been stripped of his administrative powers but the wrestlers are seeking his arrest over allegations of sexual harassment against female wrestlers.

Wrestlers including Olympic medallists Sakshi Malik and Bajrang Punia issued a joint statement on Tuesday spelling out their next step in the north Indian town of Haridwar.

""For us, our medals are sacred, and so is the river Ganges,"" they said in a statement in Hindi.

""This holy river is the perfect custodian of our medals, not the system that shields the offender.""

The athletes said that after throwing their medals into the river they would return to New Delhi to begin a hunger strike at the India Gate war memorial.","Indian athletes to toss medals into Ganges as they demand official's arrest","https://www.reuters.com/world/india/indian-athletes-toss-medals-into-ganges-they-demand-officials-arrest-2023-05-30/"
"Thomson Reuters","https://www.reuters.com/technology/top-ai-ceos-experts-raise-risk-extinction-ai-2023-05-30/","2023 Reuters","2023-05-30T12:00:00.000Z","1","Top artificial intelligence executives including OpenAI CEO Sam Altman on Tuesday joined experts and professors in raising the ""risk of extinction from AI"", which they urged policymakers to equate at par with risks posed by pandemics and nuclear war.","/pf/resources/images/reuters/favicon/favicon.ico?d=143","https://www.reuters.com/resizer/FKMkxEjnxRu6MvmIC_pItDuBg3s=/1200x628/smart/filters:quality(80)/cloudfront-us-east-2.images.arcpublishing.com/reuters/LJBC7P3YLNPDXMJZPYEMFJF7KQ.jpg","EF:TECHNOLOGY-DISRUPTED,CMPNY,ENV,EU,GEN,INTAG,ITSE,ITSE08,MLAISV,NETSV,POL,PUBL,SOCMED,SOFW,SOFW1,SRCHEN,SWIT,TECH,TECH08,TMT,WEU,EASIA,AMERS,SCANDV,US,EUROP,SE,NORD,NAMER,ASXPAC,EMRG,CN,ASIA,FIN","en","https://www.safe.ai/statement-on-ai-risk","published","https://www.reuters.com/companies/MSFT.O","(MSFT.O)","https://www.reuters.com/companies/GOOGL.O","(GOOGL.O)","https://www.safe.ai/press-release","statement","https://www.reuters.com/companies/META.O","(META.O)","/technology/eu-us-weigh-china-ai-trade-strains-high-level-sweden-talks-2023-05-30/","regulating AI","/technology/musk-experts-urge-pause-training-ai-systems-that-can-outperform-gpt-4-2023-03-29/","first ones","/technology/white-house-takes-new-steps-study-ai-risks-determine-impact-workers-2023-05-23/","sparked fears","/technology/ai-pioneer-says-its-threat-world-may-be-more-urgent-than-climate-change-2023-05-05/","told Reuters","/technology/openai-has-no-plans-leave-europe-ceo-2023-05-26/","reversed","/technology/openai-ceos-threat-quit-eu-draws-lawmaker-backlash-2023-05-25/","criticism","/technology/eus-von-der-leyen-meet-openai-ceo-altman-thursday-2023-05-30/","meet","https://www.thomsonreuters.com/en/about-us/trust-principles.html","The Thomson Reuters Trust Principles.","reuters.com","https://www.reuters.com/technology/top-ai-ceos-experts-raise-risk-extinction-ai-2023-05-30/","Reuters","https://www.reuters.com/world/",,"Top AI CEOs, experts raise 'risk of extinction' from AI","https://www.reuters.com/world/","STOCKHOLM, May 30 (Reuters) - Top artificial intelligence executives including OpenAI CEO Sam Altman on Tuesday joined experts and professors in raising the ""risk of extinction from AI"", which they urged policymakers to equate at par with risks posed by pandemics and nuclear war.

""Mitigating the risk of extinction from AI should be a global priority alongside other societal-scale risks such as pandemics and nuclear war,"" more than 350 signatories wrote in a letter published by the nonprofit Center for AI Safety (CAIS).

As well as Altman, they included the CEOs of AI firms DeepMind and Anthropic, and executives from Microsoft (MSFT. O) and Google (GOOGL.O).

Also among them were Geoffrey Hinton and Yoshua Bengio - two of the three so-called ""godfathers of AI"" who received the 2018 Turing Award for their work on deep learning - and professors from institutions ranging from Harvard to China's Tsinghua University.

A statement from CAIS singled out Meta (META. O), where the third godfather of AI, Yann LeCun, works, for not signing the letter.

The letter coincided with the U. S.-EU Trade and Technology Council meeting in Sweden where politicians are expected to talk about regulating AI.

Elon Musk and a group of AI experts and industry executives were the first ones to cite potential risks to society in April.

Recent developments in AI have created tools supporters say can be used in applications from medical diagnostics to writing legal briefs, but this has sparked fears the technology could lead to privacy violations, power misinformation campaigns, and lead to issues with ""smart machines"" thinking for themselves.

AI pioneer Hinton earlier told Reuters that AI could pose a ""more urgent"" threat to humanity than climate change.

Last week OpenAI CEO Sam Altman referred to EU AI - the first efforts to create a regulation for AI - as over-regulation and threatened to leave Europe. He reversed his stance within days after criticism from politicians.","Top AI CEOs, experts raise 'risk of extinction' from AI","https://www.reuters.com/technology/top-ai-ceos-experts-raise-risk-extinction-ai-2023-05-30/"
"By Philip Pullella","https://www.reuters.com/world/europe/beyond-sistine-chapel-vatican-museums-says-we-are-much-more-2023-05-30/","2023 Reuters","2023-05-30T12:00:00.000Z","1","Barbara Jatta, the first woman to head the Vatican Museums, wants visitors to avoid being suffocated by the crowds and take in the lesser-known - but spectacular - attractions she helps to oversee.","/pf/resources/images/reuters/favicon/favicon.ico?d=143","https://www.reuters.com/resizer/Vl2RTuAWxP84iUU7B5FRycPgjh0=/1200x628/smart/filters:quality(80)/cloudfront-us-east-2.images.arcpublishing.com/reuters/W2A3G2WTDJNWFKIHKLXVVQTS4Q.jpg","MTPIX,ART,CCOS,CHRI,COVID,CYCS,CYCS08,ENT,ENTS,GEN,HEA,HUMDIS,INFDIS,LIF,MSEUM,PXP,REL,RELX,SOCI,WEU,IT,EUROP,EZC,VA,TOPNWS","en","https://www.thomsonreuters.com/en/about-us/trust-principles.html","The Thomson Reuters Trust Principles.",,,,,,,,,,,,,,,,,,,,,,,,,"reuters.com","https://www.reuters.com/world/europe/beyond-sistine-chapel-vatican-museums-says-we-are-much-more-2023-05-30/","Reuters","https://www.reuters.com/world/",,"Beyond the Sistine Chapel, Vatican Museums says 'we are much more'","https://www.reuters.com/world/","[1/4] Barbara Jatta, director of the Vatican Museums, speaks to a reporter during the opening of a new exhibit of ceramic jars and other utensils used in a 17th century pharmacy that was once at the Benedictine monastery, at the Vatican, May 25, 2023. Jatta wants visitors to slow down and enjoy such... Read more

[1/4] Barbara Jatta, director of the Vatican Museums, speaks to a reporter during the opening of a new exhibit of ceramic jars and other utensils used in a 17th century pharmacy that was once at the Benedictine monastery, at the Vatican, May 25, 2023. Jatta wants visitors to slow down and enjoy such... Read more

VATICAN CITY, May 30 (Reuters) - Barbara Jatta, the first woman to head the Vatican Museums, wants visitors to avoid being suffocated by the crowds and take in the lesser-known - but spectacular - attractions she helps to oversee.

The Vatican Museums, a UNESCO World Heritage Site that closed or limited openings during the COVID-19 pandemic, have almost returned to their pre-pandemic level of about six million visitors a year.

Many, particularly day trippers on fast-paced package tours of Rome, head straight for the Sistine Chapel, bypassing the museums' other wonders.

""Not everyone in the Sistine Chapel. Please! We are much more,"" she told Reuters at the opening of an exhibition of ceramics within metres of Michelangelo's frescoed masterpiece.

""We have so many things that speak of history, it is important to get to know them too,"" added Jatta, 60.

They include a 17th-century pharmacy and apothecary that was run by Benedictine nuns in the Monastery of St. Cecilia in Rome's Trastevere district.

Open to the public since May 25, the pharmacy that served the public until 1936 has been reassembled with contents dating from the 17th and 18th centuries.

Cabinet shelves are filled with dozens of finely decorated blue-and-white ceramic jars that once held medicinal plants and herbs used to treat anything from insect bites to urinary infections.

The exhibition also includes tools for cutting and pressing the plants and extracting their essential essences. The nuns fashioned a large stone mortar from the capital of an ancient Roman column.

""This is an incredible patrimony of history, art and medicine,"" said Luca Pesante, one of the curators of the exhibit, which also includes mediaeval floor tiles and decorative plates, some made from designs by Raphael.

Jatta, appointed by Pope Francis in 2016, said she and her staff has set as a priority to give visitors ""the most marvellous visit possible"" and that they should not be suffocated by too many people.

She added that the museums, which close at 6 p.m. on most days, may extend opening hours. Already, they stay open later on Fridays and Saturdays.

Nearly all tickets are booked online and are often sold out weeks in advance.

The need for extended opening hours may increase during the 2025 Holy Year, when millions more people than usual are expected to travel to Rome to participate in religious pilgrimages, she said.","Beyond the Sistine Chapel, Vatican Museums says 'we are much more'","https://www.reuters.com/world/europe/beyond-sistine-chapel-vatican-museums-says-we-are-much-more-2023-05-30/"
"By Sabine Siebold","https://www.reuters.com/world/nato-seeks-narrow-differences-over-ukraine-membership-bid-2023-05-30/","2023 Reuters","2023-05-30T12:00:00.000Z","1","NATO foreign ministers will seek to narrow divisions over Ukraine's membership bid at a meeting in Oslo this week, with allies at odds over calls to grant Kyiv a road map to accession at their July summit.","/pf/resources/images/reuters/favicon/favicon.ico?d=143","https://www.reuters.com/resizer/jDbSGpiwHJrrQ6NSF7FqJXDachY=/1200x628/smart/filters:quality(80)/cloudfront-us-east-2.images.arcpublishing.com/reuters/LBH4PSKXFRPPFPDSJEGQXFFOBM.jpg","CWP,DIP,EU,GEN,INTAG,NATO,POL,WAR,CEEU,WEU,AMERS,SWASIA,SCANDV,BALT,US,EUROP,SE,NO,NORD,MEAST,TR,UA,RU,NASIA,EZC,SEEU,NAMER,ASXPAC,CISC,DE,EMRG,ASIA,LT,EEU,TOPNWS,TOPCMB","en","/world/europe/ukraine-joining-nato-midst-war-not-agenda-stoltenberg-2023-05-24/","not be able","/world/nato-struggles-shadows-find-new-leader-2023-05-26/","new NATO chief","https://www.thomsonreuters.com/en/about-us/trust-principles.html","The Thomson Reuters Trust Principles.",,,,,,,,,,,,,,,,,,,,,"reuters.com","https://www.reuters.com/world/nato-seeks-narrow-differences-over-ukraine-membership-bid-2023-05-30/","Reuters","https://www.reuters.com/world/",,"NATO seeks to narrow differences over Ukraine membership bid","https://www.reuters.com/world/","BRUSSELS, May 30 (Reuters) - NATO foreign ministers will seek to narrow divisions over Ukraine's membership bid at a meeting in Oslo this week, with allies at odds over calls to grant Kyiv a road map to accession at their July summit.

NATO has not acceded to Ukraine's request for fast-track membership as Western governments such as the U. S. and Germany are wary of moves that they fear could take the alliance closer to entering an active war with Russia.

However, both Kyiv and some of its closest allies in eastern Europe have been pushing for NATO to at least take concrete steps to bring Ukraine closer to membership at the alliance's summit in Vilnius, Lithuania, on July 11-12.

""It would be very sad if in any way anyone could read the outcome of the Vilnius summit as a victory of Russia in precluding Ukraine to join NATO one day,"" Lithuanian Prime Minister Ingrida Simonyte said on Friday.

Last week, NATO Secretary-General Jens Stoltenberg made it clear that Ukraine will not be able to join the alliance as long as the war against Russia continues.

""To become a member in the midst of a war is not on the agenda,"" he said. ""The issue is what happens when the war ends.""

NATO agreed at its 2008 summit in Bucharest that Ukraine will join eventually.

However, leaders have since stopped short of steps such as giving Kyiv a membership action plan that would lay out a timetable for bringing the country closer to NATO.

On the sidelines of their Oslo meeting on Wednesday and Thursday, foreign ministers are also expected to touch on the search for a new NATO chief, with Stoltenberg due to step down in September.

Meanwhile, President Tayyip Erdogan's election victory in Turkey has brought fresh momentum to efforts to break a deadlock over the ratification of Sweden's NATO membership, held up by objections from Turkey and Hungary.

Any progress in Oslo is unlikely, however, as Turkish Foreign Minister Mevlut Cavusoglu will not be there, Sweden said, although talks between him and Sweden's Tobias Billstrom will nevertheless take place ""soon"".","NATO seeks to narrow differences over Ukraine membership bid","https://www.reuters.com/world/nato-seeks-narrow-differences-over-ukraine-membership-bid-2023-05-30/"
