"author/0","canonicalLink","copyright","date","depth","description","favicon","image","keywords","lang","links/0/href","links/0/text","links/1/href","links/1/text","links/2/href","links/2/text","links/3/href","links/3/text","links/4/href","links/4/text","links/5/href","links/5/text","links/6/href","links/6/text","links/7/href","links/7/text","links/8/href","links/8/text","links/9/href","links/9/text","links/10/href","links/10/text","links/11/href","links/11/text","links/12/href","links/12/text","loadedDomain","loadedUrl","publisher","referrer","screenshotUrl","softTitle","startUrl","text","title","url"
"Reuters","https://www.reuters.com/world/kremlin-says-russia-will-take-part-brics-summit-proper-level-2023-05-30/","2023 Reuters","2023-05-30T12:00:00.000Z","1","The Kremlin said on Tuesday that Russia would take part at the ""proper level"" in a planned summit in South Africa of the BRICS nations, responding to a question on whether President Vladimir Putin would attend the gathering.","/pf/resources/images/reuters/favicon/favicon.ico?d=143","https://www.reuters.com/resizer/cuIixhO-4wJ6Ch2NPlxOMy4AzLI=/1200x628/smart/filters:quality(80)/cloudfront-us-east-2.images.arcpublishing.com/reuters/YJCCOWNEDJKLXKWTMOX7Z25ZJE.jpg","AIR,AIRL,AIRL1,AIRS08,CLJ,CMPNY,CWP,DIP,GEN,ICC,INDS,INDS08,INTAG,JUDIC,NEWS1,POL,PSSNGR,PUBL,SECUR,TPT,TRAN,WAR,ZA,CEEU,AFR,EUROP,SAFR,UA,RU,NASIA,ASXPAC,CISC,EMRG,ASIA,LEGAL,REUTERS-LEGAL,TOPNWS,TOPCMB,SASIA,EASIA,AMERS,IN,BR,LATAM,CN,SAMER,EEU","en","/world/us-says-video-shows-russian-jet-intercepted-spy-drone-near-ukraine-2023-03-16/","issued","https://www.thomsonreuters.com/en/about-us/trust-principles.html","The Thomson Reuters Trust Principles.",,,,,,,,,,,,,,,,,,,,,,,"reuters.com","https://www.reuters.com/world/kremlin-says-russia-will-take-part-brics-summit-proper-level-2023-05-30/","Reuters","https://www.reuters.com/world/",,"Kremlin says Russia will take part in BRICS summit at 'proper level'","https://www.reuters.com/world/","MOSCOW, May 30 (Reuters) - The Kremlin said on Tuesday that Russia would take part at the ""proper level"" in a planned summit in South Africa of the BRICS nations, responding to a question on whether President Vladimir Putin would attend the gathering.

South Africa, a member of the International Criminal Court (ICC), would theoretically be required to arrest Putin under a warrant issued by the court for his arrest for alleged war crimes.

However it has invited Putin to the Aug. 22-24 summit of the BRICS grouping of emerging economies, which comprises Brazil, Russia, India, China and South Africa.

""Russia attaches enormous importance to the development of this format of integration. And Russia will take part in this summit at the proper level,"" Kremlin spokesman Dmitry Peskov told a regular news briefing.

Pressed on the possibility of the warrant being implemented by South Africa, Peskov said: ""Of course we count as a bare minimum on partner countries in such an important format not being guided by such illegal decisions.""

Peskov said further details on the issue would be announced later, without elaborating.

The ICC issued an arrest warrant in March for Putin, accusing him of the war crime of forcibly deporting children from Russian-occupied territory in Ukraine. Moscow denies committing war crimes including forced deportations of children, and says the ICC has no authority as Russia is not a member.

Putin, only the third serving president to have been issued an arrest warrant by the ICC, is unlikely to end up in court any time soon. But the warrant means that he could be arrested and sent to The Hague if he travels to any ICC member states.","Kremlin says Russia will take part in BRICS summit at 'proper level'","https://www.reuters.com/world/kremlin-says-russia-will-take-part-brics-summit-proper-level-2023-05-30/"
"Reuters","https://www.reuters.com/world/turkey-wants-action-nato-hopeful-sweden-over-flag-incident-2023-05-30/","2023 Reuters","2023-05-30T12:00:00.000Z","1","Turkey called on NATO hopeful Sweden on Tuesday to prosecute those responsible for projecting the flag of an outlawed group onto the parliament building in Stockholm, on the day of Turkish elections that extended President Tayyip Erdogan's rule.","/pf/resources/images/reuters/favicon/favicon.ico?d=143","https://www.reuters.com/resizer/iv8iMhoPqR-01Z957JYgn_OsCmA=/1200x628/smart/filters:quality(80)/cloudfront-us-east-2.images.arcpublishing.com/reuters/UMQ3QNRGOVMYNNYATBQRG3KILQ.jpg","CWP,DEF,DIP,GEN,INTAG,NATO,NEWS1,POL,PXP,SECUR,VOTE,WAR,WEU,AMERS,SWASIA,SCANDV,US,EUROP,SE,DK,NO,NORD,MEAST,TR,EZC,SEEU,NAMER,ASXPAC,FI,EMRG,ASIA","en","https://www.thomsonreuters.com/en/about-us/trust-principles.html","The Thomson Reuters Trust Principles.",,,,,,,,,,,,,,,,,,,,,,,,,"reuters.com","https://www.reuters.com/world/turkey-wants-action-nato-hopeful-sweden-over-flag-incident-2023-05-30/","Reuters","https://www.reuters.com/world/",,"Turkey wants action from NATO hopeful Sweden over flag incident","https://www.reuters.com/world/","ANKARA, May 30 (Reuters) - Turkey called on NATO hopeful Sweden on Tuesday to prosecute those responsible for projecting the flag of an outlawed group onto the parliament building in Stockholm, on the day of Turkish elections that extended President Tayyip Erdogan's rule.

A Swedish parliament spokesperson said a number of people projected messages onto the building in Sweden's capital late on Sunday, adding it had no documentation about what was projected.

The warning could raise the stakes ahead of a mid-July NATO summit at which some alliance members are urging Turkey to back Sweden's membership bid, after a year of delays over concerns that Stockholm must do more to take on militant groups.

Footage first shared on Twitter by the so-called Swedish Solidarity Committee for Rojava - a reference to Kurdish regions of Syria - projected a flag of the Kurdistan Workers' Party (PKK) on the parliament building.

Another image shared by the account includes text reading ""Freedom for Ocalan,"" referring to the PKK's jailed leader Abdullah Ocalan, which was also projected onto the building.

""We expect the Swedish authorities to investigate this incident, hold accountable those responsible, and stop self-identified members of PKK — which the EU recognises as a terrorist entity — from operating on Swedish soil,"" Fahrettin Altun, the Turkish presidency's communications director, said on Twitter.

The parliament spokesperson said: ""During the night towards Monday, a number of people stood on a quay on the other side of the water seen from the Riksdag (Swedish parliament) building and projected messages onto the Riksdag building.""

""The persons left when the Riksdag's security guards arrived,"" the spokesperson added in an email.

The incident took place after Erdogan won a mandate in runoff elections to carry on his muscular foreign policy in which Turkey objected to both Sweden's and Finland's bids to join NATO last year in the face of Russia's invasion of Ukraine.

Turkey ratified Finland's bid in March but still objects to Sweden, saying Stockholm harbours members of militant groups it considers to be terrorists and has not fulfilled its part of last year's deal meant to assuage Ankara's security concerns.

Bids for membership must be approved by all NATO members.

Altun said he hoped Sweden would properly enforce a new anti-terror law taking effect on 1 June, and prevent PKK members from demonstrating at a protest against Sweden's NATO membership called by the solidarity committee for June 4.

Ahmet Berat Conkar, former chair of parliament's Foreign Affairs Committee and head of Turkey's delegation at the NATO Parliamentary Assembly, said that Turkey expects more engagement from Sweden on how their terrorism laws are being implemented.

""These factors will be important in our parliament's decision on Swedish membership. But on a positive note, as you see in Finland's case, Turkey is open to NATO enlargement and we will apply the same standard to Sweden as well,"" he said in an interview.","Turkey wants action from NATO hopeful Sweden over flag incident","https://www.reuters.com/world/turkey-wants-action-nato-hopeful-sweden-over-flag-incident-2023-05-30/"
"Thomson Reuters","https://www.reuters.com/world/americas/south-american-presidents-led-by-lula-seek-new-shared-agenda-2023-05-30/","2023 Reuters","2023-05-30T12:00:00.000Z","1","South American presidents are gathering in Brasilia on Tuesday for their first summit in almost a decade at the invitation of Brazil's leftist leader Luiz Inacio Lula da Silva, who aims to regain his country's active role in regional affairs.","/pf/resources/images/reuters/favicon/favicon.ico?d=143","https://www.reuters.com/resizer/FVCuUvZEoMYFN89fWZMj2l5UWJ4=/1200x628/smart/filters:quality(80)/cloudfront-us-east-2.images.arcpublishing.com/reuters/PHLOU4ZADBPSFMXZUVTOYII4OU.jpg","RSBI:CLIMATE-CHANGE,MTVID,MTPIX,CLC,DIP,ENV,GEN,POL,VOTE,WRM,AMERS,UY,CL,SR,EC,VE,GY,BR,AR,EMRG,LATAM,PY,WINDIE,CO,SAMER","en","/world/americas/venezuelas-maduro-meets-lula-first-visit-brazil-since-2015-2023-05-29/","he and Lula","https://www.thomsonreuters.com/en/about-us/trust-principles.html","The Thomson Reuters Trust Principles.",,,,,,,,,,,,,,,,,,,,,,,"reuters.com","https://www.reuters.com/world/americas/south-american-presidents-led-by-lula-seek-new-shared-agenda-2023-05-30/","Reuters","https://www.reuters.com/world/",,"South American presidents led by Lula seek new shared agenda","https://www.reuters.com/world/","[1/2] Brazil's President Luiz Inacio Lula da Silva meets with Venezuela's President Nicolas Maduro (not pictured) before a summit with presidents of South America to discuss the re-launching of the regional cooperation bloc UNASUR, in Brasilia, Brazil, May 29, 2023. REUTERS/Ueslei Marcelino

[1/2] Brazil's President Luiz Inacio Lula da Silva meets with Venezuela's President Nicolas Maduro (not pictured) before a summit with presidents of South America to discuss the re-launching of the regional cooperation bloc UNASUR, in Brasilia, Brazil, May 29, 2023. REUTERS/Ueslei Marcelino

BRASILIA, May 30 (Reuters) - South American presidents are gathering in Brasilia on Tuesday for their first summit in almost a decade at the invitation of Brazil's leftist leader Luiz Inacio Lula da Silva, who aims to regain his country's active role in regional affairs.

Ideological divisions undermined a previous attempt at regional cooperation called Unasur created by leftist presidents in 2008 that floundered when several countries elected right-wing governments, creating diplomatic fissures on the continent.

The invited presidents from all 12 of the continent's sovereign states, except Peru, will debate ways to coordinate on fighting climate change and high inflation in a region where poverty and hunger are on the rise.

""We won't decide anything at tomorrow's meeting, it is just about discussing possibilities,"" Lula told a news conference on Monday with Venezuelan President Nicolas Maduro, on his first visit to Brazil in eight years.

Lula said the leaders did not have to recreate a new Unasur but could come up with a different sort of organization.

""The main idea is that we need a bloc to work together on economic, investment and environmental issues. We need to learn to talk to each other,"" he told reporters.

Maduro is hoping the South American countries will unite in calling on the United States to lift its sanctions against Venezuela, which he and Lula assailed at their news conference.

Lula's return to office this year has brought a restoration of diplomatic ties between Brasilia and Caracas that had broken down under far-right former President Jair Bolsonaro, who banned Maduro from entering Brazil.

Brazilian officials organizing the summit said it was designed to keep political divisions from hindering cooperation.

""We are aware that there are ideological differences between the countries, but Lula wants to reactivate regional dialogue based on the common denominators the countries have,"" said Gisele Padovan, Secretary for Latin America and the Caribbean at Brazil's Foreign Ministry.

""The aim of this initiative is to unite all the countries of the region once again,"" she told reporters on Friday.

Unasur was set up during Lula's previous presidency, along with the leftist leaders of Venezuela and Argentina at the time, Hugo Chavez and Cristina Kirchner.

But its last meeting was in 2015, as divisions began to paralyze the group and South American diplomacy was marked by governments split between left and right, especially after the impeachment of Lula's successor in Brazil, Dilma Rouusseff.

In 2019, as the region's political pendulum swung the other way, the right-wing bloc ProSur was set up by then-presidents of Chile and Colombia, Sebastian Piñera and Ivan Duque. Also present were Brazil's Bolsonaro and Argentina's Mauricio Macri, along with conservative leaders of Ecuador, Peru and Paraguay.

That group has also lost steam as elections swung several of those governments back to the left.","South American presidents led by Lula seek new shared agenda","https://www.reuters.com/world/americas/south-american-presidents-led-by-lula-seek-new-shared-agenda-2023-05-30/"
"Reuters","https://www.reuters.com/world/europe/russias-reaction-drone-attacks-moscow-2023-05-30/","2023 Reuters","2023-05-30T12:00:00.000Z","1","Ukraine launched its biggest ever drone attack on Moscow on Tuesday but air defences destroyed all eight of the drones, Russia said, bringing the 15-month war in Ukraine to the heart of the capital.","/pf/resources/images/reuters/favicon/favicon.ico?d=143","https://www.reuters.com/resizer/pTcHSUTs7zrpocnwT3TeDO12dJQ=/1200x628/smart/filters:quality(80)/cloudfront-us-east-2.images.arcpublishing.com/reuters/EAGH3C6UOVMH5GQGALQK7LE5KU.jpg","REPI:GRID-INFRASTRUCTURE,MTVID,MTPIX,TOPNWS,AER,AERO,CCOS,COM,CWP,CYCS,CYCS08,DEF,DIP,DRONEM,ENR,EU,GEN,INDG,INDG08,INDS,INDS08,INTAG,MDIA,MDIA08,NATO,NEWS1,NRG,NUCL,POL,PPL,PUB,SECUR,TMT,TNPT,TOPCMB,WAR,CEEU,AMERS,US,EUROP,UA,RU,NASIA,NAMER,ASXPAC,CISC,EMRG,ASIA,EEU","en","/world/europe/drones-hit-several-buildings-moscow-mayor-2023-05-30/","drone attack","/world/europe/russian-mp-says-three-drones-downed-over-exclusive-moscow-suburb-2023-05-30/","exclusive Moscow suburb of Rublyovka","https://www.thomsonreuters.com/en/about-us/trust-principles.html","The Thomson Reuters Trust Principles.",,,,,,,,,,,,,,,,,,,,,"reuters.com","https://www.reuters.com/world/europe/russias-reaction-drone-attacks-moscow-2023-05-30/","Reuters","https://www.reuters.com/world/",,"Russia's reaction to the drone attacks on Moscow","https://www.reuters.com/world/","MOSCOW, May 30 (Reuters) - Ukraine launched its biggest ever drone attack on Moscow on Tuesday but air defences destroyed all eight of the drones, Russia said, bringing the 15-month war in Ukraine to the heart of the capital.

Here are some Russian reactions to the attacks.

""The president's working day started very early today. He received direct information both via the Defence Ministry and via the relevant departments."" He also received ""information from the Mayor of Moscow, the governor of the Moscow region, the Ministry of Emergency Situations"".

""Everything worked properly, worked well. The air defence system also worked well. It is quite clear that we are talking about the Kyiv regime's response to our very effective strikes on one of the decision-making centres... on Sunday.

""This once again confirms the need to continue this special military operation and achieve the set goals.""

""It is, of course, obvious that this is an attack by the Kyiv regime. And this must be absolutely clearly understood.""

""This morning, the Kyiv regime launched a terrorist attack with unmanned aerial vehicles on premises in the city of Moscow.

""Eight unmanned aerial vehicles were involved in the attack. All enemy drones were hit.

""Three of them were suppressed by electronic warfare, lost control and deviated from their intended goals. Five more unmanned aerial vehicles were shot down by the Pantsir-S anti-aircraft missile and cannon complex in the Moscow region.""

Prigozhin, known for his expletive-laced language, commented on reports that drones had been downed over the exclusive Moscow suburb of Rublyovka, home to members of Russia's political, military and business elite whom he has often criticised fiercely as being insufficiently committed to the war.

""Why the fuck are you allowing these drones to fly to Moscow? Who gives a shit that they are flying to your homes on Rublyovka! Let your houses burn,"" said Prigozhin.

""And what should ordinary people do when drones with explosives crash into their windows? So as a citizen, I am deeply outraged that these scum sit quietly with their arseholes smeared with expensive creams. And that's why I think the people have every right to ask them these questions, these bastards.

""But I have already warned about this many times, but no one wants to listen. Because I'm angry and I upset bureaucrats who have a great life.""

""Early this morning, as a result of the UAV attack, minor damage occurred in several buildings.""

""The sabotage and terrorist attacks of Ukraine will only increase,"" Khinshtein said. ""It is necessary to radically strengthen defence and security measures, especially in terms of countering drones. This includes finally passing the necessary laws.""

""The fact that all 8 UAVs, according to the Ministry of Defence, were shot down by the air defence system or suppressed by electronic warfare is remarkable. But this should not reassure anyone. Do not underestimate the enemy!""

""I would not give in to panic about the drone attack on Moscow and the Moscow region. Of all their number, almost nothing flew to target. I'm more concerned about where they came from, who launches them?

""Firstly, it is necessary to make an analysis and draw conclusions, and, secondly, SMERSH (the much feared military counter-intelligence agency formed under Josef Stalin during World War Two) is necessary. Probably other powers are needed today so that the security forces can work at full capacity in all regions of the Russian Federation and beyond. This will instantly have an effect so that no bastard is allowed to wander around our country and crap all over the place.""","Russia's reaction to the drone attacks on Moscow","https://www.reuters.com/world/europe/russias-reaction-drone-attacks-moscow-2023-05-30/"
"Reuters","https://www.reuters.com/world/india/india-monsoon-advances-after-stalling-11-days-2023-05-30/","2023 Reuters","2023-05-30T12:00:00.000Z","1","India's monsoon rains advanced into some more parts of southwest Bay of Bengal after stalling for the past 11 days at a far-flung island, weather department said on Tuesday.","/pf/resources/images/reuters/favicon/favicon.ico?d=143","https://www.reuters.com/resizer/WDwm1vMS2zvZgDtADpBUcY8KK0U=/1200x628/smart/filters:quality(80)/cloudfront-us-east-2.images.arcpublishing.com/reuters/NK7ZD2ARAJIBHH3IFHINHB2EVQ.jpg","RSBI:WATER-MANAGEMENT,AGRI,APPA,COM,COR,COT,COTFAR,CYCP,CYCP08,CYCS,CYCS08,ENV,FARM,FOBE,FOD,FOTB,GEN,GRA,NCYC,OILS,POIL,PRCP,RICE1,SFTS,SOIL,SOY1,SUG,SUGFAR,TEX,TXTL,UTIL,WATR,WEA,WHT,SASIA,IN,ASEAN,MY,SEASIA,LK,ASXPAC,ID,EMRG,ASIA","en","/world/india/india-monsoon-rains-arrive-late-hit-kerala-june-4-weather-office-2023-05-16/","June 4","https://www.thomsonreuters.com/en/about-us/trust-principles.html","The Thomson Reuters Trust Principles.",,,,,,,,,,,,,,,,,,,,,,,"reuters.com","https://www.reuters.com/world/india/india-monsoon-advances-after-stalling-11-days-2023-05-30/","Reuters","https://www.reuters.com/world/",,"India monsoon advances after stalling for 11 days","https://www.reuters.com/world/","MUMBAI, May 30 (Reuters) - India's monsoon rains advanced into some more parts of southwest Bay of Bengal after stalling for the past 11 days at a far-flung island, weather department said on Tuesday.

The monsoon, the lifeblood of the country's $3 trillion economy, delivers nearly 70% of the rain that India needs to water farms and recharge reservoirs and aquifers.

Nearly half of India's farmland, without any irrigation cover, depends on the annual June-September rains to grow a number of crops.

Monsoon rains arrived over the remote Andaman and Nicobar Islands on May 19, but then didn't make any progress until May 30, the India Meteorological Department (IMD) said.

Monsoon advanced into some parts of southwest Bay of Bengal on Tuesday and conditions are favourable for further advance into more parts of the region during the next 2-3 days, the IMD said.

Rains usually lash mainland Kerala around June 1 and cover the whole country by mid-July. Timely rains trigger planting of crops such as rice, soybeans and cotton.

This year, the onset of the monsoon over Kerala is likely to be slightly delayed. The onset of monsoon rains over the southern Indian state is likely to be on June 4, with a model error of plus/minus 4 days.","India monsoon advances after stalling for 11 days","https://www.reuters.com/world/india/india-monsoon-advances-after-stalling-11-days-2023-05-30/"
